,Symbol,Name,Country,Sector,Industry
1820,CVV,CVD Equipment Corporation Common Stock,United States,Technology,Industrial Machinery/Components
1821,CVX,Chevron Corporation Common Stock,United States,Energy,Integrated oil Companies
1822,CW,Curtiss-Wright Corporation Common Stock,United States,Technology,Industrial Machinery/Components
1823,CWBC,Community West Bancshares Common Stock,United States,Finance,Major Banks
1824,CWBR,CohBar Inc. Common Stock,United States,Health Care,Major Pharmaceuticals
1825,CWCO,Consolidated Water Co. Ltd. Ordinary Shares,Cayman Islands,Public Utilities,Water Supply
1826,CWEN,Clearway Energy Inc. Class C Common Stock,United States,Public Utilities,Electric Utilities: Central
1827,CWH,Camping World Holdings Inc. Class A Commom Stock,United States,Consumer Durables,Automotive Aftermarket
1828,CWK,Cushman & Wakefield plc Ordinary Shares,,Finance,Real Estate
1829,CWST,Casella Waste Systems Inc. Class A Common Stock,United States,Public Utilities,Environmental Services
1830,CWT,California Water Service Group Common Stock,United States,Public Utilities,Water Supply
1831,CX,Cemex S.A.B. de C.V. Sponsored ADR,Mexico,Capital Goods,Building Materials
1832,CXDC,China XD Plastics Company Limited Common Stock,China,Capital Goods,Containers/Packaging
1833,CXDO,Crexendo Inc. Common Stock,United States,Public Utilities,Telecommunications Equipment
1834,CXE,MFS High Income Municipal Trust Common Stock,United States,,
1835,CXH,MFS Investment Grade Municipal Trust Common Stock,United States,,
1836,CXP,Columbia Property Trust Inc. Common Stock,United States,Consumer Services,Real Estate Investment Trusts
1837,CXW,CoreCivic Inc. Common Stock,United States,Consumer Services,Real Estate Investment Trusts
1838,CYAD,Celyad Oncology SA American Depositary Shares,Belgium,Health Care,Major Pharmaceuticals
1839,CYAN,Cyanotech Corporation Common Stock,United States,Consumer Durables,Specialty Chemicals
1840,CYBE,CyberOptics Corporation Common Stock,United States,Capital Goods,Electronic Components
1841,CYBR,CyberArk Software Ltd. Ordinary Shares,Israel,Technology,Computer Software: Prepackaged Software
1842,CYCC,Cyclacel Pharmaceuticals Inc. Common Stock,United States,Health Care,Major Pharmaceuticals
1843,CYCCP,Cyclacel Pharmaceuticals Inc. 6% Convertible Preferred Stock,United States,Health Care,Major Pharmaceuticals
1844,CYCN,Cyclerion Therapeutics Inc. Common Stock,United States,Health Care,Major Pharmaceuticals
1845,CYD,China Yuchai International Limited Common Stock,Singapore,Energy,Industrial Machinery/Components
1846,CYH,Community Health Systems Inc. Common Stock,United States,Health Care,Hospital/Nursing Management
1847,CYRN,CYREN Ltd. Ordinary Shares,United States,Technology,Computer Software: Prepackaged Software
1848,CYRX,CryoPort Inc. Common Stock,United States,Health Care,Major Pharmaceuticals
1849,CYTH,Cyclo Therapeutics Inc. Common Stock,United States,Basic Industries,Major Chemicals
1850,CYTHW,Cyclo Therapeutics Inc. Warrant,United States,Basic Industries,Major Chemicals
1851,CYTK,Cytokinetics Incorporated Common Stock,United States,Health Care,Major Pharmaceuticals
1852,CZNC,Citizens & Northern Corp Common Stock,United States,Finance,Major Banks
1853,CZR,Caesars Entertainment Inc. Common Stock,United States,Consumer Services,Hotels/Resorts
1854,CZWI,Citizens Community Bancorp Inc. Common Stock,United States,Finance,Savings Institutions
1855,D,Dominion Energy Inc. Common Stock,United States,Public Utilities,Electric Utilities: Central
1856,DAC,Danaos Corporation Common Stock,Greece,Transportation,Marine Transportation
1857,DADA,Dada Nexus Limited American Depositary Shares,China,Technology,Computer Software: Programming Data Processing
1858,DAIO,Data I/O Corporation Common Stock,United States,Capital Goods,Electrical Products
1859,DAKT,Daktronics Inc. Common Stock,United States,Consumer Durables,Miscellaneous manufacturing industries
1860,DAL,Delta Air Lines Inc. Common Stock,United States,Transportation,Air Freight/Delivery Services
1861,DAN,Dana Incorporated Common Stock ,United States,Capital Goods,Auto Parts:O.E.M.
1862,DAO,Youdao Inc. American Depositary Shares each representing one Class A Ordinary Share,,Consumer Services,Other Consumer Services
1863,DAR,Darling Ingredients Inc. Common Stock,United States,Consumer Non-Durables,Packaged Foods
1864,DARE,Dare Bioscience Inc. Common Stock,United States,Health Care,Major Pharmaceuticals
1865,DASH,DoorDash Inc. Class A Common Stock,,Miscellaneous,Business Services
1866,DAUG,FT Cboe Vest U.S. Equity Deep Buffer ETF - August,United States,,
1867,DAVA,Endava plc American Depositary Shares (each representing one Class A Ordinary Share),,Technology,EDP Services
1868,DB,Deutsche Bank AG Common Stock,Germany,Finance,Major Banks
1869,DBD,Diebold Nixdorf Incorporated Common Stock,United States,Miscellaneous,Office Equipment/Supplies/Services
1870,DBDR,Roman DBDR Tech Acquisition Corp. Class A Common Stock,United States,Finance,Business Services
1871,DBDRU,Roman DBDR Tech Acquisition Corp. Unit,United States,Finance,Business Services
1872,DBDRW,Roman DBDR Tech Acquisition Corp. Warrant,United States,Finance,Business Services
1873,DBI,Designer Brands Inc. Class A Common Stock,United States,Consumer Services,Clothing/Shoe/Accessory Stores
1874,DBL,DoubleLine Opportunistic Credit Fund Common Shares of Beneficial Interest,United States,,
1875,DBOC,Innovator Double Stacker 9 Buffer ETF - October,,,
1876,DBTX,Decibel Therapeutics Inc. Common Stock,United States,Health Care,Major Pharmaceuticals
1877,DBVT,DBV Technologies S.A. American Depositary Shares,France,Health Care,Biotechnology: Biological Products (No Diagnostic Substances)
1878,DBX,Dropbox Inc. Class A Common Stock,United States,Technology,Computer Software: Prepackaged Software
1879,DCBO,Docebo Inc. Common Shares,Canada,Technology,Computer Software: Prepackaged Software
1880,DCF,BNY Mellon Alcentra Global Credit Income 2024 Target Term Fund Inc. Common Stock,,,
1881,DCI,Donaldson Company Inc. Common Stock,United States,Capital Goods,Pollution Control Equipment
1882,DCO,Ducommun Incorporated Common Stock,United States,Capital Goods,Military/Government/Technical
1883,DCOM,Dime Community Bancshares Inc. Common Stock,United States,Finance,Savings Institutions
1884,DCOMP,Dime Community Bancshares Inc. Fixed-Rate Non-Cumulative Perpetual Preferred Stock Series A,United States,Finance,Major Banks
1885,DCP,DCP Midstream  LP Common Units ,United States,Public Utilities,Natural Gas Distribution
1886,DCP^B,DCP Midstream LP 7.875% Series B Fixed-to-Floating Rate Cumulative Redeemable Perpetual Preferred Units,United States,,
1887,DCP^C,DCP Midstream LP 7.95% Series C Fixed-to-Floating Rate Cumulative Redeemable Perpetual Preferred Units,United States,,
1888,DCPH,Deciphera Pharmaceuticals Inc. Common Stock,United States,Health Care,Major Pharmaceuticals
1889,DCRB,Decarbonization Plus Acquisition Corporation Class A Common Stock,United States,Energy,Industrial Machinery/Components
1890,DCRBU,Decarbonization Plus Acquisition Corporation Unit,United States,Energy,Industrial Machinery/Components
1891,DCRBW,Decarbonization Plus Acquisition Corporation Warrant,United States,Energy,Industrial Machinery/Components
1892,DCRCU,Decarbonization Plus Acquisition Corporation III Unit,United States,Finance,Business Services
1893,DCRN,Decarbonization Plus Acquisition Corporation II Class A Common stock,United States,Finance,Business Services
1894,DCRNU,Decarbonization Plus Acquisition Corporation II Unit,United States,Finance,Business Services
1895,DCRNW,Decarbonization Plus Acquisition Corporation II Warrant,United States,Finance,Business Services
1896,DCT,Duck Creek Technologies Inc. Common Stock,United States,Technology,Computer Software: Prepackaged Software
1897,DCTH,Delcath Systems Inc. Common Stock,United States,Health Care,Medical/Dental Instruments
1898,DCUE,Dominion Energy Inc. 2019 Series A Corporate Units,United States,Public Utilities,Electric Utilities: Central
1899,DD,DuPont de Nemours Inc. Common Stock,,Basic Industries,Major Chemicals
1900,DDD,3D Systems Corporation Common Stock,United States,Technology,Computer Software: Prepackaged Software
1901,DDEC,FT Cboe Vest U.S. Equity Deep Buffer ETF - December,United States,,
1902,DDF,Delaware Investments Dividend & Income Fund Inc. Common Stock,United States,,
1903,DDMX,DD3 Acquisition Corp. II Class A Common Stock,Mexico,Finance,Business Services
1904,DDMXU,DD3 Acquisition Corp. II Unit,Mexico,Finance,Business Services
1905,DDMXW,DD3 Acquisition Corp. II Warrant,Mexico,Finance,Business Services
1906,DDOG,Datadog Inc. Class A Common Stock,United States,Technology,Computer Software: Prepackaged Software
1907,DDS,Dillard's Inc. Common Stock,United States,Consumer Services,Department/Specialty Retail Stores
1908,DDT,Dillard's Capital Trust I,United States,Consumer Services,Department/Specialty Retail Stores
1909,DE,Deere & Company Common Stock,United States,Capital Goods,Industrial Machinery/Components
1910,DEA,Easterly Government Properties Inc. Common Stock,United States,Consumer Services,Real Estate Investment Trusts
1911,DECK,Deckers Outdoor Corporation Common Stock,United States,Consumer Non-Durables,Shoe Manufacturing
1912,DEFN,Emles Trust Emles Protective Allocation ETF,,,
1913,DEH,D8 Holdings Corp. Class A Ordinary Shares,Hong Kong,Finance,Business Services
1914,DEI,Douglas Emmett Inc. Common Stock,United States,Consumer Services,Real Estate Investment Trusts
1915,DELL,Dell Technologies Inc. Class C Common Stock ,,Technology,Computer Manufacturing
1916,DEN,Denbury Inc. Common Stock,,Energy,Oil & Gas Production
1917,DENN,Denny's Corporation Common Stock,United States,Consumer Services,Restaurants
1918,DEO,Diageo plc Common Stock,United Kingdom,Consumer Non-Durables,Beverages (Production/Distribution)
1919,DESP,Despegar.com Corp. Ordinary Shares,,Consumer Services,Transportation Services
1920,DEX,Delaware Enhanced Global Dividend Common Shares of Beneficial Interest,United States,,
1921,DFEB,FT Cboe Vest U.S. Equity Deep Buffer ETF - February,United States,,
1922,DFFN,Diffusion Pharmaceuticals Inc. Common Stock,United States,Health Care,Major Pharmaceuticals
1923,DFH,Dream Finders Homes Inc. Class A Common Stock,United States,Capital Goods,Homebuilding
1924,DFHT,Deerfield Healthcare Technology Acquisitions Corp. Class A Common Stock,United States,Health Care,Hospital/Nursing Management
1925,DFHTW,Deerfield Healthcare Technology Acquisitions Corp. Warrant,United States,Health Care,Hospital/Nursing Management
1926,DFHY,TrimTabs Donoghue Forlines Tactical High Yield ETF,,,
1927,DFIN,Donnelley Financial Solutions Inc. Common Stock ,,Consumer Services,Other Consumer Services
1928,DFNS,LGL Systems Acquisition Corp. Common Stock,United States,Finance,Business Services
1929,DFNV,TrimTabs Donoghue Forlines Risk Managed Innovation ETF,,,
1930,DFP,Flaherty & Crumrine Dynamic Preferred and Income Fund Inc. Common Stock,,,
1931,DFPH,DFP Healthcare Acquisitions Corp. Class A Common Stock,United States,Finance,Business Services
1932,DFPHW,DFP Healthcare Acquisitions Corp. Warrant,United States,Finance,Business Services
1933,DFS,Discover Financial Services Common Stock,United States,Finance,Finance: Consumer Services
1934,DG,Dollar General Corporation Common Stock,United States,Consumer Services,Department/Specialty Retail Stores
1935,DGICA,Donegal Group Inc. Class A Common Stock,United States,Finance,Property-Casualty Insurers
1936,DGICB,Donegal Group Inc. Class B Common Stock,United States,Finance,Property-Casualty Insurers
1937,DGII,Digi International Inc. Common Stock,United States,Technology,Computer Communications Equipment
1938,DGLY,Digital Ally Inc. Common Stock,United States,Technology,Radio And Television Broadcasting And Communications Equipment
1939,DGNR,Dragoneer Growth Opportunities Corp. Class A Ordinary Shares,United States,Finance,Business Services
1940,DGNS,Dragoneer Growth Opportunities Corp. II Class A Ordinary Shares,United States,Finance,Business Services
1941,DGNU,Dragoneer Growth Opportunities Corp. III Class A Ordinary Shares,United States,Finance,Business Services
1942,DGX,Quest Diagnostics Incorporated Common Stock,United States,Health Care,Medical Specialities
1943,DHBCU,DHB Capital Corp. Unit,United States,Finance,Business Services
1944,DHC,Diversified Healthcare Trust Common Shares of Beneficial Interest,United States,Consumer Services,Real Estate Investment Trusts
1945,DHCAU,DHC Acquisition Corp. Unit,United States,Finance,Business Services
1946,DHCNI,Diversified Healthcare Trust 5.625% Senior Notes due 2042,United States,Consumer Services,Real Estate Investment Trusts
1947,DHCNL,Diversified Healthcare Trust 6.25% Senior Notes Due 2046,United States,Consumer Services,Real Estate Investment Trusts
1948,DHF,BNY Mellon High Yield Strategies Fund Common Stock,United States,,
1949,DHHC,DiamondHead Holdings Corp. Class A Common Stock,United States,Finance,Business Services
1950,DHHCU,DiamondHead Holdings Corp. Unit,United States,Finance,Business Services
1951,DHHCW,DiamondHead Holdings Corp. Warrant,United States,Finance,Business Services
1952,DHI,D.R. Horton Inc. Common Stock,United States,Capital Goods,Homebuilding
1953,DHIL,Diamond Hill Investment Group Inc. Class A Common Stock,United States,Finance,Investment Managers
1954,DHR,Danaher Corporation Common Stock,United States,Capital Goods,Industrial Machinery/Components
1955,DHR^A,Danaher Corporation 4.75% Mandatory Convertible Preferred Stock Series A,United States,,
1956,DHR^B,Danaher Corporation 5.00% Mandatory Convertible Preferred Stock Series B,United States,,
1957,DHT,DHT Holdings Inc.,Jersey,Transportation,Marine Transportation
1958,DHX,DHI Group Inc. Common Stock,United States,Miscellaneous,Business Services
1959,DHY,Credit Suisse High Yield Bond Fund Common Stock,United States,,
1960,DIAX,Nuveen Dow 30SM Dynamic Overwrite Fund Common Shares of Beneficial Interest,,,
1961,DIN,Dine Brands Global Inc. Common Stock,United States,Consumer Services,Restaurants
1962,DIOD,Diodes Incorporated Common Stock,United States,Technology,Semiconductors
1963,DIS,Walt Disney Company (The) Common Stock,United States,Consumer Services,Services-Misc. Amusement & Recreation
1964,DISAU,Disruptive Acquisition Corporation I Unit,United States,Finance,Business Services
1965,DISCA,Discovery Inc. Series A Common Stock,United States,Consumer Services,Television Services
1966,DISCB,Discovery Inc. Series B Common Stock,United States,Consumer Services,Television Services
1967,DISCK,Discovery Inc. Series C Common Stock,United States,Consumer Services,Television Services
1968,DISH,DISH Network Corporation Class A Common Stock,United States,Consumer Services,Television Services
1969,DIT,AMCON Distributing Company Common Stock,United States,Consumer Non-Durables,Food Distributors
1970,DJAN,FT Cboe Vest U.S. Equity Deep Buffer ETF - January,United States,,
1971,DJCO,Daily Journal Corp. (S.C.) Common Stock,United States,Consumer Services,Newspapers/Magazines
1972,DJUL,FT Cboe Vest U.S. Equity Deep Buffer ETF - July,United States,,
1973,DJUN,FT Cboe Vest U.S. Equity Deep Buffer ETF - June,United States,,
1974,DK,Delek US Holdings Inc. Common Stock,United States,Energy,Integrated oil Companies
1975,DKL,Delek Logistics Partners L.P. Common Units representing Limited Partner Interests,United States,Energy,Natural Gas Distribution
1976,DKNG,DraftKings Inc. Class A Common Stock,United States,Consumer Services,Services-Misc. Amusement & Recreation
1977,DKS,Dick's Sporting Goods Inc Common Stock,United States,Consumer Services,Other Specialty Stores
1978,DLA,Delta Apparel Inc. Common Stock,United States,Consumer Non-Durables,Apparel
1979,DLB,Dolby Laboratories Common Stock,United States,Miscellaneous,Multi-Sector Companies
1980,DLCA,Deep Lake Capital Acquisition Corp. Class A Ordinary Shares,United States,Finance,Business Services
1981,DLCAU,Deep Lake Capital Acquisition Corp. Unit,United States,Finance,Business Services
1982,DLCAW,Deep Lake Capital Acquisition Corp. Warrant,United States,Finance,Business Services
1983,DLHC,DLH Holdings Corp.,United States,Technology,Professional Services
1984,DLNG,Dynagas LNG Partners LP Common Units,Greece,Consumer Services,Marine Transportation
1985,DLNG^A,Dynagas LNG Partners LP 9.00% Series A Cumulative Redeemable Preferred Units,Greece,,
1986,DLNG^B,Dynagas LNG Partners LP 8.75% Series B Fixed to Floating Rate Cumulative Redeemable Perpetual Preferred Units liquidation preference $25.00 per Uni,Greece,,
1987,DLPN,Dolphin Entertainment Inc. Common Stock,United States,Consumer Services,Other Consumer Services
1988,DLR,Digital Realty Trust Inc. Common Stock,United States,Consumer Services,Real Estate Investment Trusts
1989,DLR^C,Digital Realty Trust Inc. 6.625% Series C Cumulative Redeemable Perpetual Preferred Stock,United States,,
1990,DLR^J,Digital Realty Trust Inc. 5.250% Series J Cumulative Redeemable Preferred Stock,United States,,
1991,DLR^K,Digital Realty Trust Inc. 5.850% Series K Cumulative Redeemable Preferred Stock par value $0.01 per share,United States,,
1992,DLR^L,Digital Realty Trust Inc. 5.200% Series L Cumulative Redeemable Preferred Stock,United States,,
1993,DLTH,Duluth Holdings Inc. Class B Common Stock,United States,Consumer Services,Clothing/Shoe/Accessory Stores
1994,DLTR,Dollar Tree Inc. Common Stock,United States,Consumer Services,Department/Specialty Retail Stores
1995,DLX,Deluxe Corporation Common Stock,United States,Consumer Durables,Publishing
1996,DLY,DoubleLine Yield Opportunities Fund Common Shares of Beneficial Interest,,,
1997,DM,Desktop Metal Inc. Class A Common Stock,,Technology,Industrial Machinery/Components
1998,DMAC,DiaMedica Therapeutics Inc. Common Stock,United States,Health Care,Major Pharmaceuticals
1999,DMAR,FT Cboe Vest U.S. Equity Deep Buffer ETF - March,United States,,
2000,DMAY,FT Cboe Vest U.S. Equity Deep Buffer ETF - May,United States,,
2001,DMB,BNY Mellon Municipal Bond Infrastructure Fund Inc. Common Stock,,,
2002,DMF,BNY Mellon Municipal Income Inc. Common Stock,United States,,
2003,DMLP,Dorchester Minerals L.P. Common Units Representing Limited Partnership Interests,United States,Energy,Oil & Gas Production
2004,DMO,Western Asset Mortgage Opportunity Fund Inc. Common Stock,United States,,
2005,DMRC,Digimarc Corporation Common Stock,United States,Technology,EDP Services
2006,DMS,Digital Media Solutions Inc. Class A Ordinary Shares,United States,Miscellaneous,Business Services
2007,DMTK,DermTech Inc. Common Stock,United States,Health Care,Medical Specialities
2008,DMYD,dMY Technology Group Inc. II Class A Common Stock,United States,Finance,Business Services
2009,DMYI,dMY Technology Group Inc. III Class A Common Stock,United States,Finance,Business Services
2010,DNB,Dun & Bradstreet Holdings Inc. Common Stock,United States,Finance,Finance: Consumer Services
2011,DNLI,Denali Therapeutics Inc. Common Stock,United States,Health Care,Biotechnology: Biological Products (No Diagnostic Substances)
2012,DNMR,Danimer Scientific Inc. Common Stock,,Basic Industries,Major Chemicals
2013,DNN,Denison Mines Corp Ordinary Shares (Canada),Canada,Basic Industries,Precious Metals
2014,DNOV,FT Cboe Vest U.S. Equity Deep Buffer ETF - November,United States,,
2015,DNOW,NOW Inc. Common Stock,,Energy,Metal Fabrications
2016,DNP,DNP Select Income Fund Inc. Common Stock,United States,,
2017,DNZ,D and Z Media Acquisition Corp. Class A Common Stock,,Finance,Business Services
2018,DOC,Physicians Realty Trust Common Shares of Beneficial Interest,United States,Consumer Services,Real Estate Investment Trusts
2019,DOCN,DigitalOcean Holdings Inc. Common Stock,,Technology,Computer Software: Programming Data Processing
2020,DOCT,FT Cboe Vest U.S. Equity Deep Buffer ETF - October,United States,,
2021,DOCU,DocuSign Inc. Common Stock,United States,Technology,Computer Software: Prepackaged Software
2022,DOGZ,Dogness (International) Corporation Class A Common Stock,China,Consumer Durables,Miscellaneous manufacturing industries
2023,DOMO,Domo Inc. Class B Common Stock,United States,Technology,Computer Software: Prepackaged Software
2024,DOOO,BRP Inc. (Recreational Products) Common Subordinate Voting Shares,Canada,Capital Goods,Industrial Specialties
2025,DOOR,Masonite International Corporation Ordinary Shares (Canada),Canada,Basic Industries,Forest Products
2026,DORM,Dorman Products Inc. Common Stock,United States,Capital Goods,Auto Parts:O.E.M.
2027,DOV,Dover Corporation Common Stock,United States,Technology,Industrial Machinery/Components
2028,DOW,Dow Inc. Common Stock ,,Basic Industries,Major Chemicals
2029,DOX,Amdocs Limited Ordinary Shares,Guernsey,Technology,EDP Services
2030,DOYU,DouYu International Holdings Limited ADS,China,Technology,Computer Software: Programming Data Processing
2031,DPG,Duff & Phelps Utility and Infrastructure Fund Inc.,United States,,
2032,DPW,Ault Global Holdings Inc. Common Stock,United States,Capital Goods,Industrial Machinery/Components
2033,DPZ,Domino's Pizza Inc Common Stock,United States,Consumer Non-Durables,Food Distributors
2034,DQ,DAQO New Energy Corp. American Depositary Shares each representing five ordinary shares,China,Technology,Semiconductors
2035,DRD,DRDGOLD Limited American Depositary Shares,South Africa,Basic Industries,Precious Metals
2036,DRE,Duke Realty Corporation Common Stock,United States,Consumer Services,Real Estate Investment Trusts
2037,DRH,Diamondrock Hospitality Company Common Stock,United States,Consumer Services,Real Estate Investment Trusts
2038,DRH^A,Diamondrock Hospitality Company 8.250% Series A Cumulative Redeemable Preferred Stock,United States,,
2039,DRI,Darden Restaurants Inc. Common Stock,United States,Consumer Services,Restaurants
2040,DRIO,DarioHealth Corp. Common Stock,Israel,Health Care,Medical/Dental Instruments
2041,DRNA,Dicerna Pharmaceuticals Inc. Common Stock,United States,Health Care,Major Pharmaceuticals
2042,DRQ,Dril-Quip Inc. Common Stock,United States,Energy,Metal Fabrications
2043,DRRX,DURECT Corporation Common Stock,United States,Health Care,Major Pharmaceuticals
2044,DRTT,DIRTT Environmental Solutions Ltd. Common Shares,Canada,Technology,Computer Software: Prepackaged Software
2045,DRUA,Dominion Energy Inc. 2016 Series A 5.25% Enhanced Junior Subordinated Notes due 2076,United States,Public Utilities,Electric Utilities: Central
2046,DRVN,Driven Brands Holdings Inc. Common Stock,United States,Consumer Services,Automotive Aftermarket
2047,DS,Drive Shack Inc.,United States,Consumer Services,Restaurants
2048,DS^B,Drive Shack Inc. Preferred Series B,United States,,
2049,DS^C,Drive Shack Inc. Preferred Series C,United States,,
2050,DS^D,Drive Shack Inc. Pfd Ser D,United States,,
2051,DSAC,Duddell Street Acquisition Corp. Class A Ordinary Shares,Hong Kong,Finance,Business Services
2052,DSACU,Duddell Street Acquisition Corp. Unit,Hong Kong,Finance,Business Services
2053,DSACW,Duddell Street Acquisition Corp. Warrant,Hong Kong,Finance,Business Services
2054,DSE,Duff & Phelps Select MLP and Midstream Energy Fund Inc.,United States,,
2055,DSEP,FT Cboe Vest U.S. Equity Deep Buffer ETF - September,United States,,
2056,DSEY,Diversey Holdings Ltd. Ordinary Shares,United States,Consumer Durables,Specialty Chemicals
2057,DSGN,Design Therapeutics Inc. Common Stock,United States,Health Care,Major Pharmaceuticals
2058,DSGX,Descartes Systems Group Inc. (The) Common Stock,Canada,Technology,Computer Software: Prepackaged Software
2059,DSKE,Daseke Inc. Common Stock,United States,Consumer Services,Transportation Services
2060,DSKEW,Daseke Inc. Warrant,United States,Consumer Services,Transportation Services
2061,DSL,DoubleLine Income Solutions Fund Common Shares of Beneficial Interests,,,
2062,DSM,BNY Mellon Strategic Municipal Bond Fund Inc. Common Stock,United States,,
2063,DSOC,Innovator Double Stacker ETF - October,,,
2064,DSP,Viant Technology Inc. Class A Common Stock,United States,Technology,Computer Software: Programming Data Processing
2065,DSPG,DSP Group Inc. Common Stock,United States,Technology,Semiconductors
2066,DSS,Document Security Systems Inc. Common Stock,United States,Consumer Durables,Containers/Packaging
2067,DSSI,Diamond S Shipping Inc. Common Stock ,,Consumer Services,Transportation Services
2068,DSU,Blackrock Debt Strategies Fund Inc. Common Stock,United States,,
2069,DSWL,Deswell Industries Inc. Common Shares,Macau,Consumer Non-Durables,Plastic Products
2070,DSX,Diana Shipping inc. common stock,Greece,Transportation,Marine Transportation
2071,DSX^B,Diana Shipping Inc. Perpetual Preferred Shares Series B (Marshall Islands),Greece,,
2072,DT,Dynatrace Inc. Common Stock,United States,Technology,Computer Software: Prepackaged Software
2073,DTB,DTE Energy Company 2020 Series G 4.375% Junior Subordinated Debentures due 2080,United States,Public Utilities,Electric Utilities: Central
2074,DTE,DTE Energy Company Common Stock,United States,Public Utilities,Electric Utilities: Central
2075,DTEA,DAVIDsTEA Inc. Common Stock,Canada,Consumer Non-Durables,Food Chains
2076,DTF,DTF Tax-Free Income Inc. Common Stock,United States,,
2077,DTIL,Precision BioSciences Inc. Common Stock,United States,Health Care,Biotechnology: Biological Products (No Diagnostic Substances)
2078,DTJ,DTE Energy Company 2016 Series B 5.375% Junior Subordinated Debentures due 2076,United States,Public Utilities,Electric Utilities: Central
2079,DTLA^,Brookfield DTLA Inc. 7.625% Series A Cumulative Redeemable Preferred Stock,,,
2080,DTOCU,Digital Transformation Opportunities Corp. Units,United States,Finance,Business Services
2081,DTP,DTE Energy Company 6.25% Corporate Units,United States,Public Utilities,Electric Utilities: Central
2082,DTSS,Datasea Inc. Common Stock,China,Technology,Computer Software: Prepackaged Software
2083,DTW,DTE Energy Company 2017 Series E 5.25% Junior Subordinated Debentures due 2077,United States,Public Utilities,Electric Utilities: Central
