,Symbol,Name,Country,Sector,Industry
3661,ITQ,Itiquira Acquisition Corp. Class A Ordinary Shares,United States,Finance,Business Services
3662,ITQRU,Itiquira Acquisition Corp. Unit,United States,Finance,Business Services
3663,ITQRW,Itiquira Acquisition Corp. Warrant,United States,Finance,Business Services
3664,ITRG,Integra Resources Corp. Common Shares,,Basic Industries,Precious Metals
3665,ITRI,Itron Inc. Common Stock,United States,Capital Goods,Electrical Products
3666,ITRM,Iterum Therapeutics plc Ordinary Share,Ireland,Health Care,Major Pharmaceuticals
3667,ITRN,Ituran Location and Control Ltd. Ordinary Shares,Israel,Technology,Electronic Components
3668,ITT,ITT Inc. Common Stock ,United States,Capital Goods,Fluid Controls
3669,ITUB,Itau Unibanco Banco Holding SA American Depositary Shares (Each repstg 500 Preferred shares),Brazil,Finance,Major Banks
3670,ITW,Illinois Tool Works Inc. Common Stock,United States,Technology,Industrial Machinery/Components
3671,IVA,Inventiva S.A. American Depository Shares,France,Health Care,Major Pharmaceuticals
3672,IVAC,Intevac Inc. Common Stock,United States,Technology,Industrial Machinery/Components
3673,IVAN,Ivanhoe Capital Acquisition Corp. Class A Ordinary Shares,,Finance,Business Services
3674,IVC,Invacare Corporation Common Stock,United States,Health Care,Industrial Specialties
3675,IVDG,Invesco Focused Discovery Growth ETF,United States,,
3676,IVH,Ivy High Income Opportunities Fund Common Shares of Beneficial Interest,,,
3677,IVLC,Invesco US Large Cap Core ESG ETF,United States,,
3678,IVR,INVESCO MORTGAGE CAPITAL INC Common Stock,United States,Consumer Services,Real Estate Investment Trusts
3679,IVR^A,Invesco Mortgage Capital Inc. Pfd Ser A,United States,,
3680,IVR^B,Invesco Mortgage Capital Inc. Preferred Series B Cum Fxd to Fltg,United States,,
3681,IVR^C,INVESCO MORTGAGE CAPITAL INC 7.5% Fixed-to-Floating Series C Cumulative Redeemable Preferred Stock Liquation Preference $25.00 per Share,United States,,
3682,IVRA,Invesco Real Assets ESG ETF,United States,,
3683,IVSG,Invesco Select Growth ETF,United States,,
3684,IVZ,Invesco Ltd Common Stock,United States,Finance,Investment Managers
3685,IX,Orix Corp Ads Common Stock,Japan,Finance,Diversified Financial Services
3686,IZEA,IZEA Worldwide Inc. Common Stock,United States,Consumer Services,Advertising
3687,J,Jacobs Engineering Group Inc. Common Stock,United States,Basic Industries,Military/Government/Technical
3688,JACK,Jack In The Box Inc. Common Stock,United States,Consumer Services,Restaurants
3689,JAGX,Jaguar Health Inc. Common Stock,United States,Health Care,Major Pharmaceuticals
3690,JAKK,JAKKS Pacific Inc. Common Stock,United States,Consumer Non-Durables,Recreational Products/Toys
3691,JAMF,Jamf Holding Corp. Common Stock,United States,Technology,Computer Software: Prepackaged Software
3692,JAN,JanOne Inc. Common Stock (NV),United States,Consumer Services,Home Furnishings
3693,JAX,J. Alexander's Holdings Inc. Common Stock,,Consumer Services,Restaurants
3694,JAZZ,Jazz Pharmaceuticals plc Common Stock (Ireland),Ireland,Health Care,Major Pharmaceuticals
3695,JBGS,JBG SMITH Properties Common Shares ,United States,Consumer Services,Real Estate Investment Trusts
3696,JBHT,J.B. Hunt Transport Services Inc. Common Stock,United States,Transportation,Trucking Freight/Courier Services
3697,JBK,Lehman ABS 3.50 3.50% Adjustable Corp Backed Tr Certs GS Cap I,United States,Finance,Finance: Consumer Services
3698,JBL,Jabil Inc. Common Stock,United States,Technology,Electrical Products
3699,JBLU,JetBlue Airways Corporation Common Stock,United States,Transportation,Air Freight/Delivery Services
3700,JBSS,John B. Sanfilippo & Son Inc. Common Stock,United States,Consumer Non-Durables,Specialty Foods
3701,JBT,John Bean Technologies Corporation Common Stock,United States,Technology,Industrial Machinery/Components
3702,JCE,Nuveen Core Equity Alpha Fund Nuveen Core Equity Alpha Fund Common Shares of Beneficial Interest,United States,,
3703,JCI,Johnson Controls International plc Ordinary Share,Switzerland,Consumer Services,Other Consumer Services
3704,JCIC,Jack Creek Investment Corp. Class A Ordinary Shares,United States,Finance,Business Services
3705,JCICU,Jack Creek Investment Corp. Units,United States,Finance,Business Services
3706,JCICW,Jack Creek Investment Corp. Warrants,United States,Finance,Business Services
3707,JCO,Nuveen Credit Opportunities 2022 Target Term Fund Common Shares of Beneficial Interest,United States,,
3708,JCOM,j2 Global Inc. Common Stock,United States,Technology,Telecommunications Equipment
3709,JCS,Communications Systems Inc. Common Stock,United States,Public Utilities,Telecommunications Equipment
3710,JCTCF,Jewett-Cameron Trading Company Common Shares,United States,Consumer Services,RETAIL: Building Materials
3711,JD,JD.com Inc. American Depositary Shares,China,Consumer Services,Other Specialty Stores
3712,JDD,Nuveen Diversified Dividend and Income Fund Shares of Beneficial Interest,United States,,
3713,JEF,Jefferies Financial Group Inc. Common Stock,United States,Finance,Investment Bankers/Brokers/Service
3714,JELD,JELD-WEN Holding Inc. Common Stock,United States,Basic Industries,Forest Products
3715,JEMA,J.P. Morgan Exchange-Traded Fund Trust JPMorgan Emerging Markets Equity Core ETF,,,
3716,JEMD,Nuveen Emerging Markets Debt 2022 Target Term Fund Common Shares of Beneficial Interest $0.01 par value per share,,,
3717,JEQ,Aberdeen Japan Equity Fund Inc.  Common Stock,United States,,
3718,JFIN,Jiayin Group Inc. American Depositary Shares,China,Finance,Finance: Consumer Services
3719,JFR,Nuveen Floating Rate Income Fund Common Stock,United States,,
3720,JFU,9F Inc. American Depositary Shares,China,Finance,Finance: Consumer Services
3721,JG,Aurora Mobile Limited American Depositary Shares,China,Technology,Computer Software: Programming Data Processing
3722,JGH,Nuveen Global High Income Fund Common Shares of Beneficial Interest,United States,,
3723,JHAA,Nuveen Corporate Income 2023 Target Term Fund,,,
3724,JHB,Nuveen Corporate Income November 2021 Target Term Fund,,,
3725,JHG,Janus Henderson Group plc Ordinary Shares,,Finance,Investment Managers
3726,JHI,John Hancock Investors Trust Common Stock,United States,,
3727,JHS,John Hancock Income Securities Trust Common Stock,United States,,
3728,JHX,James Hardie Industries plc American Depositary Shares (Ireland),Ireland,Capital Goods,Building Materials
3729,JIH,Juniper Industrial Holdings Inc. Class A Common Stock,,Finance,Business Services
3730,JILL,J. Jill Inc. Common Stock,,Consumer Non-Durables,Apparel
3731,JJSF,J & J Snack Foods Corp. Common Stock,United States,Consumer Non-Durables,Specialty Foods
3732,JKHY,Jack Henry & Associates Inc. Common Stock,United States,Technology,EDP Services
3733,JKS,JinkoSolar Holding Company Limited American Depositary Shares (each representing 4 Common Shares),China,Technology,Semiconductors
3734,JLL,Jones Lang LaSalle Incorporated Common Stock,United States,Finance,Real Estate
3735,JLS,Nuveen Mortgage and Income Fund,United States,,
3736,JMIA,Jumia Technologies AG American Depositary Shares each representing two Ordinary Shares,,Consumer Services,Catalog/Specialty Distribution
3737,JMM,Nuveen Multi-Market Income Fund (MA),United States,,
3738,JMP,JMP Group LLC Common Shares,United States,Finance,Investment Bankers/Brokers/Service
3739,JMPNL,JMP Group LLC 7.25% Senior Notes due 2027,United States,Finance,Investment Bankers/Brokers/Service
3740,JMPNZ,JMP Group LLC 6.875% Senior Notes due 2029,United States,Finance,Investment Bankers/Brokers/Service
3741,JNCE,Jounce Therapeutics Inc. Common Stock,United States,Health Care,Biotechnology: Biological Products (No Diagnostic Substances)
3742,JNJ,Johnson & Johnson Common Stock,United States,Health Care,Major Pharmaceuticals
3743,JNPR,Juniper Networks Inc. Common Stock,United States,Technology,Computer Communications Equipment
3744,JOAN,JOANN Inc. Common Stock,United States,Consumer Services,Other Specialty Stores
3745,JOB,GEE Group Inc. Common Stock,United States,Technology,Diversified Commercial Services
3746,JOBS,51job Inc. American Depositary Shares,China,Technology,Diversified Commercial Services
3747,JOE,St. Joe Company (The) Common Stock,United States,Consumer Services,Homebuilding
3748,JOF,Japan Smaller Capitalization Fund Inc Common Stock,United States,,
3749,JOFF,JOFF Fintech Acquisition Corp. Class A Common Stock,United States,Finance,Business Services
3750,JOFFU,JOFF Fintech Acquisition Corp. Unit,United States,Finance,Business Services
3751,JOFFW,JOFF Fintech Acquisition Corp. Warrant,United States,Finance,Business Services
3752,JOUT,Johnson Outdoors Inc. Class A Common Stock,United States,Consumer Non-Durables,Recreational Products/Toys
3753,JP,Jupai Holdings Limited American Depositary Shares each representing six ordinary shares,,Consumer Services,Other Consumer Services
3754,JPC,Nuveen Preferred & Income Opportunities Fund,United States,,
3755,JPI,Nuveen Preferred and Income Term Fund Common Shares of Beneficial Interest,,,
3756,JPM,JP Morgan Chase & Co. Common Stock,United States,Finance,Major Banks
3757,JPM^C,J P Morgan Chase & Co Depositary Shares each representing a 1/400th interest in a share of 6.00% Non-Cumulative  Preferred Stock Series EE,United States,,
3758,JPM^D,J P Morgan Chase & Co Depositary Shares each representing a 1/400th  interest in a share of 5.75% Non-Cumulative  Preferred Stock Series DD,United States,,
3759,JPM^G,J P Morgan Chase & Co Depositary Shares each representing a 1/400th interest in a share of 6.10% Non-Cumulative Preferred Stock Series AA,United States,,
3760,JPM^H,J P Morgan Chase & Co Depositary Shares each representing a 1/400th interest in a share of 6.15% Non-Cumulative Preferred Stock Series BB,United States,Finance,Major Banks
3761,JPM^J,J P Morgan Chase & Co Depositary Shares each representing a 1/400th interest in a share of JPMorgan Chase & Co. 4.75% Non-Cumulative Preferred Stock Series GG,United States,Finance,Major Banks
3762,JPM^K,J P Morgan Chase & Co Depositary Shares each representing a 1/400th interest in a share of 4.55% Non-Cumulative Preferred Stock Series JJ,United States,,
3763,JPS,Nuveen Preferred & Income Securities Fund,United States,,
3764,JPT,Nuveen Preferred and Income 2022 Term Fund Common Shares of Beneficial Interest,United States,,
3765,JQC,Nuveen Credit Strategies Income Fund Shares of Beneficial Interest,United States,,
3766,JRI,Nuveen Real Asset Income and Growth Fund Common Shares of Beneficial Interest,United States,,
3767,JRJC,China Finance Online Co. Limited American Depositary Shares,China,Finance,Investment Bankers/Brokers/Service
3768,JRO,Nuveen Floating Rate Income Opportuntiy Fund Shares of Beneficial Interest,United States,,
3769,JRS,Nuveen Real Estate Income Fund Common Shares of Beneficial Interest,United States,,
3770,JRSH,Jerash Holdings (US) Inc. Common Stock,United States,Consumer Non-Durables,Apparel
3771,JRVR,James River Group Holdings Ltd. Common Shares,Bermuda,Finance,Property-Casualty Insurers
3772,JSD,Nuveen Short Duration Credit Opportunities Fund Common Shares of Beneficial Interest,United States,,
3773,JSM,Navient Corporation 6% Senior Notes due December 15 2043,United States,Finance,Finance: Consumer Services
3774,JT,Jianpu Technology Inc. American depositary shares,,Technology,Computer Software: Programming Data Processing
3775,JTA,Nuveen Tax-Advantaged Total Return Strategy Fund Common Share of Beneficial Interest,United States,,
3776,JTD,Nuveen Tax-Advantaged Dividend Growth Fund Common Shares of Beneficial Interest,United States,,
3777,JUPW,Jupiter Wellness Inc. Common Stock,United States,Consumer Non-Durables,Package Goods/Cosmetics
3778,JUPWW,Jupiter Wellness Inc. Warrant,United States,Consumer Non-Durables,Package Goods/Cosmetics
3779,JVA,Coffee Holding Co. Inc. Common Stock,United States,Consumer Non-Durables,Packaged Foods
3780,JW/A,John Wiley & Sons Inc.,United States,,
3781,JW/B,John Wiley & Sons Inc.,United States,,
3782,JWEL,Jowell Global Ltd. Ordinary Shares,China,Consumer Services,Other Consumer Services
3783,JWN,Nordstrom Inc. Common Stock,United States,Consumer Services,Clothing/Shoe/Accessory Stores
3784,JWS,Jaws Acquisition Corp. Class A Ordinary Shares,,Health Care,Medical/Nursing Services
3785,JWSM,Jaws Mustang Acquisition Corp. Class A Ordinary Shares,,Finance,Business Services
3786,JYAC,Jiya Acquisition Corp. Class A Common Stock,United States,Finance,Business Services
3787,JYNT,The Joint Corp. Common Stock,United States,Miscellaneous,Multi-Sector Companies
3788,K,Kellogg Company Common Stock,United States,Consumer Non-Durables,Packaged Foods
3789,KAI,Kadant Inc Common Stock,United States,Technology,Industrial Machinery/Components
3790,KAIIU,Kismet Acquisition Two Corp. Unit,United States,Finance,Business Services
3791,KAIR,Kairos Acquisition Corp. Class A Ordinary Shares,United States,Finance,Business Services
3792,KAIRU,Kairos Acquisition Corp. Unit,United States,Finance,Business Services
3793,KAIRW,Kairos Acquisition Corp. Warrant,United States,Finance,Business Services
3794,KALA,Kala Pharmaceuticals Inc. Common Stock,United States,Health Care,Major Pharmaceuticals
3795,KALU,Kaiser Aluminum Corporation Common Stock,United States,Capital Goods,Metal Fabrications
3796,KALV,KalVista Pharmaceuticals Inc. Common Stock,United Kingdom,Health Care,Major Pharmaceuticals
3797,KAMN,Kaman Corporation Common Stock,United States,Capital Goods,Military/Government/Technical
3798,KAR,KAR Auction Services Inc Common Stock,United States,Consumer Durables,Automotive Aftermarket
3799,KARO,Karooooo Ltd. Ordinary Shares,Singapore,Technology,Computer Software: Prepackaged Software
3800,KB,KB Financial Group Inc,South Korea,Finance,Commercial Banks
3801,KBAL,Kimball International Inc. Class B Common Stock,United States,Consumer Durables,Home Furnishings
3802,KBH,KB Home Common Stock,United States,Capital Goods,Homebuilding
3803,KBNT,Kubient Inc. Common Stock,United States,Technology,EDP Services
3804,KBNTW,Kubient Inc. Warrant,United States,Technology,EDP Services
3805,KBR,KBR Inc. Common Stock,United States,Basic Industries,Military/Government/Technical
3806,KBSF,KBS Fashion Group Limited Common Stock,China,Consumer Non-Durables,Apparel
3807,KC,Kingsoft Cloud Holdings Limited American Depositary Shares,China,Technology,Computer Software: Prepackaged Software
3808,KCAPL,KCAP Financial Inc. 6.125% Notes due 2022,United States,,
3809,KDMN,Kadmon Holdings Inc. Common Stock,United States,Health Care,Major Pharmaceuticals
3810,KDNY,Chinook Therapeutics Inc. Common Stock,United States,Health Care,Major Pharmaceuticals
3811,KDP,Keurig Dr Pepper Inc. Common Stock,United States,Consumer Non-Durables,Beverages (Production/Distribution)
3812,KE,Kimball Electronics Inc. Common Stock,United States,Technology,Electrical Products
3813,KELYA,Kelly Services Inc. Class A Common Stock,United States,Technology,Professional Services
3814,KELYB,Kelly Services Inc. Class B Common Stock,United States,Technology,Professional Services
3815,KEN,Kenon Holdings Ltd. Ordinary Shares,Singapore,Public Utilities,Electric Utilities: Central
3816,KEP,Korea Electric Power Corporation Common Stock,South Korea,Public Utilities,Electric Utilities: Central
3817,KEQU,Kewaunee Scientific Corporation Common Stock,United States,Capital Goods,Medical Specialities
3818,KERN,Akerna Corp. Common Stock,United States,Technology,EDP Services
3819,KERNW,Akerna Corp Warrant,United States,Technology,EDP Services
3820,KEX,Kirby Corporation Common Stock,United States,Consumer Services,Marine Transportation
3821,KEY,KeyCorp Common Stock,United States,Finance,Major Banks
3822,KEY^I,KeyCorp Depositary Shares Each Representing a 1/40th Ownership Interest in a Share of Fixed-to-Floating Rate Perpetual Non-Cumulative Preferred Stock Series E,United States,,
3823,KEY^J,KeyCorp Depositary Shares each representing a 1/40th ownership interest in a share of Fixed Rate Perpetual Non-Cumulative Preferred Stock Series F,United States,,
3824,KEY^K,KeyCorp Depositary Shares each representing a 1/40th ownership interest in a share of Fixed Rate Perpetual Non-Cumulative Preferred Stock Series G,United States,,
3825,KEYS,Keysight Technologies Inc. Common Stock,United States,Capital Goods,Industrial Machinery/Components
3826,KF,Korea Fund Inc. (The) New Common Stock,United States,,
3827,KFFB,Kentucky First Federal Bancorp Common Stock,United States,Finance,Savings Institutions
3828,KFRC,Kforce Inc. Common Stock,United States,Technology,Professional Services
3829,KFS,Kingsway Financial Services Inc. Common Stock (DE),Canada,Finance,Property-Casualty Insurers
3830,KFY,Korn Ferry Common Stock,United States,Technology,Diversified Commercial Services
3831,KGC,Kinross Gold Corporation Common Stock,Canada,Basic Industries,Precious Metals
3832,KHC,The Kraft Heinz Company Common Stock,United States,Consumer Non-Durables,Packaged Foods
3833,KIDS,OrthoPediatrics Corp. Common Stock,United States,Health Care,Medical/Dental Instruments
3834,KIIIU,Kismet Acquisition Three Corp. Unit,United States,Finance,Business Services
3835,KIM,Kimco Realty Corporation Common Stock,United States,Consumer Services,Real Estate Investment Trusts
3836,KIM^L,Kimco Realty Corporation Class L Depositary Shares each of which represents a one-one thousandth fractional interest in a share of 5.125% Class L Cumulative Redeemable Preferred Stock liquidation preference $25000.00 per share,United States,,
3837,KIM^M,Kimco Realty Corporation Class M Depositary Shares each of which represents a one-one thousandth fractional interest in a share of 5.25% Class M Cumulative Redeemable Preferred Stock liquidation preference $25000.00 per share,United States,,
3838,KIN,Kindred Biosciences Inc. Common Stock,United States,Health Care,Major Pharmaceuticals
3839,KINS,Kingstone Companies Inc. Common Stock,United States,Finance,Property-Casualty Insurers
3840,KINZ,KINS Technology Group Inc. Class A Common Stock,United States,Finance,Business Services
3841,KINZU,KINS Technology Group Inc. Unit,United States,Finance,Business Services
3842,KINZW,KINS Technology Group Inc. Warrant,United States,Finance,Business Services
3843,KIO,KKR Income Opportunities Fund Common Shares,,,
3844,KIQ,Kelso Technologies Inc Ordinary Shares,Canada,Capital Goods,Railroads
3845,KIRK,Kirkland's Inc. COMMONSTOCK,United States,Consumer Services,Other Specialty Stores
3846,KJUL,Innovator Russell 2000 Power Buffer ETF - July,,,
3847,KKR,KKR & Co. Inc. Common Stock,United States,Finance,Investment Managers
3848,KKR^A,KKR & Co. Inc. 6.75% Series A Preferred Stock,United States,,
3849,KKR^B,KKR & Co. Inc. 6.50% Series B Preferred Stock,United States,,
3850,KKR^C,KKR & Co. Inc. 6.00% Series C Mandatory Convertible Preferred Stock,United States,,
3851,KL,Kirkland Lake Gold Ltd. Common Shares,,Basic Industries,Precious Metals
3852,KLAC,KLA Corporation Common Stock,United States,Capital Goods,Electronic Components
3853,KLAQ,KL Acquisition Corp Class A Common Stock,United States,Finance,Business Services
3854,KLAQU,KL Acquisition Corp Unit,United States,Finance,Business Services
3855,KLAQW,KL Acquisition Corp Warrant,United States,Finance,Business Services
3856,KLDO,Kaleido Biosciences Inc. Common Stock,United States,Health Care,Biotechnology: Biological Products (No Diagnostic Substances)
3857,KLIC,Kulicke and Soffa Industries Inc. Common Stock,Singapore,Technology,Semiconductors
3858,KLR,Kaleyra Inc. Common Stock,United States,Technology,EDP Services
3859,KLXE,KLX Energy Services Holdings Inc. Common Stock,United States,Energy,Oilfield Services/Equipment
3860,KMB,Kimberly-Clark Corporation Common Stock,United States,Consumer Durables,Containers/Packaging
3861,KMDA,Kamada Ltd. Ordinary Shares,Israel,Health Care,Major Pharmaceuticals
3862,KMF,Kayne Anderson NextGen Energy & Infrastructure Inc.,,,
3863,KMI,Kinder Morgan Inc. Common Stock,United States,Public Utilities,Natural Gas Distribution
3864,KMPH,KemPharm Inc. Common Stock,United States,Health Care,Major Pharmaceuticals
3865,KMPR,Kemper Corporation,United States,Finance,Property-Casualty Insurers
3866,KMT,Kennametal Inc. Common Stock,United States,Capital Goods,Industrial Machinery/Components
3867,KMX,CarMax Inc,United States,Consumer Durables,Automotive Aftermarket
3868,KN,Knowles Corporation Common Stock,,Consumer Non-Durables,Consumer Electronics/Appliances
3869,KNDI,Kandi Technologies Group Inc Common Stock,China,Capital Goods,Auto Manufacturing
3870,KNGS,UPHOLDINGS Compound Kings ETF,United States,,
3871,KNL,Knoll Inc. Common Stock,United States,Consumer Durables,Office Equipment/Supplies/Services
3872,KNOP,KNOT Offshore Partners LP Common Units representing Limited Partner Interests,United Kingdom,Consumer Services,Marine Transportation
3873,KNSA,Kiniksa Pharmaceuticals Ltd. Class A Common Stock,United States,Health Care,Major Pharmaceuticals
3874,KNSL,Kinsale Capital Group Inc. Common Stock,United States,Finance,Property-Casualty Insurers
3875,KNTE,Kinnate Biopharma Inc. Common Stock,United States,Health Care,Major Pharmaceuticals
3876,KNX,Knight-Swift Transportation Holdings Inc.,United States,Transportation,Trucking Freight/Courier Services
3877,KO,Coca-Cola Company (The) Common Stock,United States,Consumer Non-Durables,Beverages (Production/Distribution)
3878,KOD,Kodiak Sciences Inc Common Stock,United States,Health Care,Biotechnology: Biological Products (No Diagnostic Substances)
3879,KODK,Eastman Kodak Company Common New,United States,Miscellaneous,Industrial Machinery/Components
3880,KOF,Coca Cola Femsa S.A.B. de C.V.  American Depositary Shares each representing 10 Units (each Unit consists of 3 Series B Shares and 5 Series L Shares),Mexico,Consumer Non-Durables,Beverages (Production/Distribution)
3881,KOP,Koppers Holdings Inc. Koppers Holdings Inc. Common Stock,United States,Basic Industries,Forest Products
3882,KOPN,Kopin Corporation Common Stock,United States,Technology,Semiconductors
3883,KOR,Corvus Gold Inc. Common Shares,Canada,Basic Industries,Precious Metals
3884,KOS,Kosmos Energy Ltd. Common Shares (DE),Bermuda,Energy,Oil & Gas Production
3885,KOSS,Koss Corporation Common Stock,United States,Consumer Non-Durables,Consumer Electronics/Appliances
3886,KPTI,Karyopharm Therapeutics Inc. Common Stock,United States,Health Care,Major Pharmaceuticals
3887,KR,Kroger Company (The) Common Stock,United States,Consumer Services,Food Chains
3888,KRA,Kraton Corporation Common Stock,United States,Basic Industries,Major Chemicals
3889,KRBP,Kiromic BioPharma Inc. Common Stock,United States,Health Care,Biotechnology: Biological Products (No Diagnostic Substances)
3890,KRC,Kilroy Realty Corporation Common Stock,United States,Consumer Services,Real Estate Investment Trusts
3891,KREF,KKR Real Estate Finance Trust Inc. Common Stock,United States,Consumer Services,Real Estate Investment Trusts
3892,KRG,Kite Realty Group Trust Common Stock,United States,Consumer Services,Real Estate Investment Trusts
3893,KRKR,36Kr Holdings Inc. American Depositary Shares,China,Miscellaneous,Business Services
3894,KRMD,Repro Med Systems Inc. Common Stock,United States,Health Care,Medical/Dental Instruments
3895,KRNL,Kernel Group Holdings Inc. Class A Ordinary Shares,United States,Finance,Business Services
3896,KRNLU,Kernel Group Holdings Inc. Units,United States,Finance,Business Services
3897,KRNLW,Kernel Group Holdings Inc. Warrants,United States,Finance,Business Services
3898,KRNT,Kornit Digital Ltd. Ordinary Shares,Israel,Capital Goods,Industrial Machinery/Components
3899,KRNY,Kearny Financial Corp Common Stock,United States,Finance,Savings Institutions
3900,KRO,Kronos Worldwide Inc Common Stock,United States,Basic Industries,Major Chemicals
3901,KRON,Kronos Bio Inc. Common Stock,United States,Health Care,Major Pharmaceuticals
3902,KROS,Keros Therapeutics Inc. Common Stock,United States,Health Care,Major Pharmaceuticals
3903,KRP,Kimbell Royalty Partners Common Units Representing Limited Partner Interests,United States,Energy,Oil & Gas Production
3904,KRTX,Karuna Therapeutics Inc. Common Stock,United States,Health Care,Major Pharmaceuticals
3905,KRUS,Kura Sushi USA Inc. Class A Common Stock,United States,Consumer Services,Restaurants
3906,KRYS,Krystal Biotech Inc. Common Stock,United States,Health Care,Biotechnology: Biological Products (No Diagnostic Substances)
3907,KSICU,Kadem Sustainable Impact Corporation Unit,United States,Finance,Business Services
3908,KSM,DWS Strategic Municipal Income Trust,United States,,
3909,KSMT,Kismet Acquisition One Corp Ordinary Shares,Russia,Finance,Business Services
3910,KSMTU,Kismet Acquisition One Corp Unit,Russia,Finance,Business Services
3911,KSMTW,Kismet Acquisition One Corp Warrant,Russia,Finance,Business Services
3912,KSPN,Kaspien Holdings Inc. Common Stock,United States,Consumer Services,Consumer Electronics/Video Chains
3913,KSS,Kohl's Corporation Common Stock,United States,Consumer Services,Department/Specialty Retail Stores
3914,KSU,Kansas City Southern Common Stock,United States,Transportation,Railroads
3915,KSU^,Kansas City Southern Preferred Stock,United States,Transportation,Railroads
3916,KT,KT Corporation Common Stock,South Korea,Public Utilities,Telecommunications Equipment
3917,KTB,Kontoor Brands Inc. Common Stock ,,Consumer Non-Durables,Apparel
3918,KTCC,Key Tronic Corporation Common Stock,United States,Technology,Electrical Products
3919,KTF,DWS Municipal Income Trust,United States,,
3920,KTH,Structures Products Cp 8% CorTS Issued by Peco Energy Cap Tr II Preferred Stock,United States,Finance,Finance: Consumer Services
3921,KTN,Structured Products Corp 8.205% CorTS 8.205% Corporate Backed Trust Securities (CorTS),United States,Finance,Finance: Consumer Services
3922,KTOS,Kratos Defense & Security Solutions Inc. Common Stock,United States,Capital Goods,Military/Government/Technical
3923,KTRA,Kintara Therapeutics Inc. Common Stock,United States,Health Care,Major Pharmaceuticals
