,Symbol,Name,Country,Sector,Industry
5510,PSB^X,PS Business Parks Inc. Depositary Shares Each Representing 1/1000 of a Share of 5.25% Cumulative Preferred Stock Series X,United States,,
5511,PSB^Y,PS Business Parks Inc. 5.20% Cumulative Preferred Stock Series Y,United States,,
5512,PSB^Z,PS Business Parks Inc. Depositary Shares Each Representing 1/1000 of a Share of 4.875% Cumulative Preferred Stock Series Z  par value $0.01 per share,United States,,
5513,PSCW,Pacer Swan SOS Conservative (April) ETF,United States,,
5514,PSEC,Prospect Capital Corporation Common Stock,United States,,
5515,PSF,Cohen & Steers Select Preferred and Income Fund Inc. Common Stock,,,
5516,PSFE,Paysafe Limited Common Shares,,Finance,Business Services
5517,PSFF,Pacer Swan SOS Fund of Funds ETF,United States,,
5518,PSFM,Pacer Swan SOS Flex (April) ETF,United States,,
5519,PSHG,Performance Shipping Inc. Common Shares,Greece,Transportation,Marine Transportation
5520,PSMD,Pacer Swan SOS Moderate (December) ETF,United States,,
5521,PSMR,Pacer Swan SOS Moderate (April) ETF,United States,,
5522,PSMT,PriceSmart Inc. Common Stock,United States,Consumer Services,Department/Specialty Retail Stores
5523,PSN,Parsons Corporation Common Stock,,Technology,EDP Services
5524,PSNL,Personalis Inc. Common Stock,United States,Health Care,Medical Specialities
5525,PSO,Pearson Plc Common Stock,United Kingdom,Consumer Services,Books
5526,PSTG,Pure Storage Inc. Class A Common Stock,,Technology,Electronic Components
5527,PSTH,Pershing Square Tontine Holdings Ltd. Class A Common Stock,,Finance,Business Services
5528,PSTI,Pluristem Therapeutics Inc. Common Stock,Israel,Health Care,Biotechnology: Biological Products (No Diagnostic Substances)
5529,PSTL,Postal Realty Trust Inc. Class A Common Stock,,Consumer Services,Real Estate Investment Trusts
5530,PSTV,PLUS THERAPEUTICS Inc. Common Stock ,United States,Health Care,Medical/Dental Instruments
5531,PSTX,Poseida Therapeutics Inc. Common Stock,United States,Health Care,Biotechnology: Biological Products (No Diagnostic Substances)
5532,PSX,Phillips 66 Common Stock,United States,Energy,Integrated oil Companies
5533,PSXP,Phillips 66 Partners LP Common Units representing limited partner interest in the Partnership,United States,Energy,Natural Gas Distribution
5534,PT,Pintec Technology Holdings Limited American Depositary Shares,China,Technology,Computer Software: Programming Data Processing
5535,PTA,Cohen & Steers Tax-Advantaged Preferred Securities and Income Fund Common Shares of Beneficial Interest,,,
5536,PTC,PTC Inc. Common Stock,United States,Technology,Computer Software: Prepackaged Software
5537,PTCT,PTC Therapeutics Inc. Common Stock,United States,Health Care,Major Pharmaceuticals
5538,PTE,PolarityTE Inc. Common Stock,United States,Health Care,Biotechnology: Biological Products (No Diagnostic Substances)
5539,PTEN,Patterson-UTI Energy Inc. Common Stock,United States,Energy,Oil & Gas Production
5540,PTGX,Protagonist Therapeutics Inc. Common Stock,United States,Health Care,Major Pharmaceuticals
5541,PTIC,PropTech Investment Corporation II Class A Common Stock,United States,Finance,Business Services
5542,PTICU,PropTech Investment Corporation II Unit,United States,Finance,Business Services
5543,PTICW,PropTech Investment Corporation II Warrant,United States,Finance,Business Services
5544,PTK,PTK Acquisition Corp. Common Stock,United States,Finance,Business Services
5545,PTMN,Portman Ridge Finance Corporation Common Stock,United States,,
5546,PTN,Palatin Technologies Inc. Common Stock,United States,Health Care,Major Pharmaceuticals
5547,PTNR,Partner Communications Company Ltd. American Depositary Shares,Israel,Public Utilities,Telecommunications Equipment
5548,PTOCU,Pine Technology Acquisition Corp. Unit,United States,Finance,Business Services
5549,PTON,Peloton Interactive Inc. Class A Common Stock,United States,Consumer Non-Durables,Recreational Products/Toys
5550,PTPI,Petros Pharmaceuticals Inc. Common Stock,United States,Health Care,Major Pharmaceuticals
5551,PTR,PetroChina Company Limited Common Stock,China,Energy,Oil & Gas Production
5552,PTRS,Partners Bancorp Common Stock,United States,Finance,Major Banks
5553,PTSI,P.A.M. Transportation Services Inc. Common Stock,United States,Transportation,Trucking Freight/Courier Services
5554,PTVCA,Protective Insurance Corporation Class A Common Stock,United States,Finance,Property-Casualty Insurers
5555,PTVCB,Protective Insurance Corporation Class B Common Stock,United States,Finance,Property-Casualty Insurers
5556,PTVE,Pactiv Evergreen Inc. Common stock,United States,Consumer Durables,Containers/Packaging
5557,PTY,Pimco Corporate & Income Opportunity Fund,United States,,
5558,PUBM,PubMatic Inc. Class A Common Stock,United States,Technology,Computer Software: Programming Data Processing
5559,PUCK,Goal Acquisitions Corp. Common Stock,United States,Finance,Business Services
5560,PUCKU,Goal Acquisitions Corp. Unit,United States,Finance,Business Services
5561,PUCKW,Goal Acquisitions Corp. Warrant,United States,Finance,Business Services
5562,PUK,Prudential Public Limited Company Common Stock,United Kingdom,Finance,Life Insurance
5563,PUK^,Prudential Public Limited Company 6.75% Perpetual Subordinated Captial Security,United Kingdom,,
5564,PUK^A,Prudential Public Limited Company 6.50% Perpetual Subordinated Capital Securities Exchangeable at the Issuer's Option Into Non-Cumulative Dollar Denominated Preference Shares,United Kingdom,,
5565,PULM,Pulmatrix Inc. Common Stock,United States,Health Care,Major Pharmaceuticals
5566,PUMP,ProPetro Holding Corp. Common Stock,United States,Energy,Oilfield Services/Equipment
5567,PUYI,Puyi Inc. American Depository Shares,China,Finance,Investment Managers
5568,PV,Primavera Capital Acquisition Corporation Class A Ordinary Shares,,Finance,Business Services
5569,PVAC,Penn Virginia Corporation Common Stock,United States,Energy,Oil & Gas Production
5570,PVBC,Provident Bancorp Inc. (MD) Common Stock,United States,Finance,Savings Institutions
5571,PVG,Pretium Resources Inc. Ordinary Shares (Canada),Canada,Basic Industries,Precious Metals
5572,PVH,PVH Corp. Common Stock,United States,Consumer Non-Durables,Apparel
5573,PVL,Permianville Royalty Trust Trust Units ,United States,Energy,Oil & Gas Production
5574,PW,Power REIT (MD) Common Stock,United States,Consumer Services,Real Estate Investment Trusts
5575,PW^A,Power REIT 7.75% Series A Cumulative Perpetual Preferred Stock,United States,,
5576,PWFL,PowerFleet Inc. Common Stock,United States,Capital Goods,Telecommunications Equipment
5577,PWOD,Penns Woods Bancorp Inc. Common Stock,United States,Finance,Major Banks
5578,PWR,Quanta Services Inc. Common Stock,United States,Capital Goods,Engineering & Construction
5579,PXD,Pioneer Natural Resources Company Common Stock,United States,Energy,Oil & Gas Production
5580,PXLW,Pixelworks Inc.  Common Stock,United States,Technology,Semiconductors
5581,PXS,Pyxis Tankers Inc. Common Stock,Greece,Transportation,Marine Transportation
5582,PXSAP,Pyxis Tankers Inc. 7.75% Series A Cumulative Convertible Preferred Shares,Greece,Transportation,Marine Transportation
5583,PXSAW,Pyxis Tankers Inc. Warrant,Greece,Transportation,Marine Transportation
5584,PYN,PIMCO New York Municipal Income Fund III Common Shares of Beneficial Interest,United States,,
5585,PYPD,PolyPid Ltd. Ordinary Shares,Israel,Health Care,Medical/Dental Instruments
5586,PYPL,PayPal Holdings Inc. Common Stock,United States,Miscellaneous,Business Services
5587,PYR,PyroGenesis Canada Inc. Common Shares,Canada,Health Care,Major Pharmaceuticals
5588,PYS,Merrill Lynch Depositor Inc PPlus Tr Ser RRD-1 Tr Ctf Cl A,United States,Finance,Finance: Consumer Services
5589,PYT,PPlus Tr GSC-2 Tr Ctf Fltg Rate,United States,Finance,Finance: Consumer Services
5590,PZC,PIMCO California Municipal Income Fund III Common Shares of Beneficial Interest,United States,,
5591,PZG,Paramount Gold Nevada Corp. Common Stock,United States,Basic Industries,Precious Metals
5592,PZN,Pzena Investment Management Inc Class A Common Stock,United States,Finance,Investment Managers
5593,PZZA,Papa John's International Inc. Common Stock,United States,Consumer Services,Restaurants
5594,QADA,QAD Inc. Class A Common Stock,United States,Technology,Computer Software: Prepackaged Software
5595,QADB,QAD Inc. Class B Common Stock,United States,Technology,Computer Software: Prepackaged Software
5596,QCOM,QUALCOMM Incorporated Common Stock,United States,Technology,Radio And Television Broadcasting And Communications Equipment
5597,QCON,American Century ETF Trust American Century Quality Convertible Securities ETF,,,
5598,QCRH,QCR Holdings Inc. Common Stock,United States,Finance,Major Banks
5599,QD,Qudian Inc. American Depositary Shares each representing one Class A Ordinary Share,China,Finance,Finance: Consumer Services
5600,QDEC,FT Cboe Vest Growth-100 Buffer ETF - December,United States,,
5601,QDEL,Quidel Corporation Common Stock,United States,Health Care,Biotechnology: In Vitro & In Vivo Diagnostic Substances
5602,QELL,Qell Acquisition Corp. Class A Ordinary Shares,United States,Finance,Business Services
5603,QELLU,Qell Acquisition Corp. Unit,United States,Finance,Business Services
5604,QELLW,Qell Acquisition Corp. Warrant,United States,Finance,Business Services
5605,QFIN,360 DigiTech Inc. American Depositary Shares,China,Finance,Finance: Consumer Services
5606,QFTA,Quantum FinTech Acquisition Corporation Common Stock,,Finance,Business Services
5607,QGEN,Qiagen N.V. Common Shares ,Netherlands,Health Care,Biotechnology: Biological Products (No Diagnostic Substances)
5608,QH,Quhuo Limited American Depository Shares,China,Miscellaneous,Business Services
5609,QIWI,QIWI plc American Depositary Shares,Cyprus,Miscellaneous,Business Services
5610,QK,Q&K International Group Limited American Depositary Shares,China,Finance,Real Estate
5611,QLGN,Qualigen Therapeutics Inc. Common Stock,United States,Health Care,Major Pharmaceuticals
5612,QLI,Qilian International Holding Group Ltd. Ordinary Shares,China,Health Care,Major Pharmaceuticals
5613,QLYS,Qualys Inc. Common Stock,United States,Technology,Computer Software: Prepackaged Software
5614,QMAR,FT Cboe Vest Growth-100 Buffer ETF - March,United States,,
5615,QMCO,Quantum Corporation Common Stock,United States,Technology,Electronic Components
5616,QNST,QuinStreet Inc. Common Stock,United States,Miscellaneous,Business Services
5617,QPFF,American Century ETF Trust American Century Quality Preferred ETF,,,
5618,QQQX,Nuveen NASDAQ 100 Dynamic Overwrite Fund Shares of Beneficial Interest,United States,,
5619,QRHC,Quest Resource Holding Corporation Common Stock,United States,Technology,Diversified Commercial Services
5620,QRTEA,Qurate Retail Inc. Series A Common Stock ,United States,Consumer Services,Catalog/Specialty Distribution
5621,QRTEB,Qurate Retail Inc. Series B Common Stock ,United States,Consumer Services,Catalog/Specialty Distribution
5622,QRTEP,Qurate Retail Inc. 8.0% Fixed Rate Cumulative Redeemable Preferred Stock,United States,Consumer Services,Catalog/Specialty Distribution
5623,QRVO,Qorvo Inc. Common Stock,United States,Technology,Semiconductors
5624,QS,QuantumScape Corporation Class A Common Stock,United States,Miscellaneous,Industrial Machinery/Components
5625,QSR,Restaurant Brands International Inc. Common Shares,Canada,Consumer Services,Restaurants
5626,QTAP,Innovator Growth Accelerated Plus ETF - April,,,
5627,QTNT,Quotient Limited Ordinary Shares,Switzerland,Health Care,Biotechnology: In Vitro & In Vivo Diagnostic Substances
5628,QTRX,Quanterix Corporation Common Stock,United States,Capital Goods,Biotechnology: Laboratory Analytical Instruments
5629,QTS,QTS Realty Trust Inc. Class A Common Stock,United States,Consumer Services,Real Estate Investment Trusts
5630,QTS^A,QTS Realty Trust Inc. 7.125% Series A Cumulative Redeemable Perpetual Preferred Stock,United States,,
5631,QTS^B,QTS Realty Trust Inc. 6.50% Series B Cumulative Convertible Perpetual Preferred Stock,United States,,
5632,QTT,Qutoutiao Inc. American Depositary Shares,China,Technology,Computer Software: Programming Data Processing
5633,QTWO,Q2 Holdings Inc. Common Stock,,Technology,Computer Software: Prepackaged Software
5634,QUAD,Quad Graphics Inc Class A Common Stock,United States,Miscellaneous,Publishing
5635,QUIK,QuickLogic Corporation Common Stock,United States,Technology,Semiconductors
5636,QUMU,Qumu Corporation Common Stock,United States,Technology,Computer Software: Prepackaged Software
5637,QUOT,Quotient Technology Inc. Common Stock,,Consumer Services,Advertising
5638,QURE,uniQure N.V. Ordinary Shares,Netherlands,Health Care,Major Pharmaceuticals
5639,QVCC,QVC Inc. 6.250% Senior Secured Notes due 2068,United States,Consumer Services,Catalog/Specialty Distribution
5640,QVCD,QVC Inc. 6.375% Senior Secured Notes due 2067,United States,Consumer Services,Catalog/Specialty Distribution
5641,R,Ryder System Inc. Common Stock,United States,Consumer Services,Rental/Leasing Companies
5642,RA,Brookfield Real Assets Income Fund Inc. Common Stock,,,
5643,RAAC,Revolution Acceleration Acquisition Corp Class A Common Stock,United States,Capital Goods,Industrial Machinery/Components
5644,RAACU,Revolution Acceleration Acquisition Corp Unit,United States,Capital Goods,Industrial Machinery/Components
5645,RAACW,Revolution Acceleration Acquisition Corp Warrant,United States,Capital Goods,Industrial Machinery/Components
5646,RAAS,Cloopen Group Holding Limited American Depositary Shares each representing two Class A Ordinary Shares,,Technology,Computer Software: Prepackaged Software
5647,RACA,Therapeutics Acquisition Corp. Class A Common Stock,United States,Health Care,Major Pharmaceuticals
5648,RACB,Research Alliance Corp. II Class A Common Stock,United States,Finance,Business Services
5649,RACE,Ferrari N.V. Common Shares,,Capital Goods,Auto Manufacturing
5650,RAD,Rite Aid Corporation Common Stock,United States,Health Care,Medical/Nursing Services
5651,RADA,RADA Electronic Industries Ltd. Ordinary Shares,Israel,Technology,Electronic Components
5652,RADI,Radius Global Infrastructure Inc. Class A Common Stock,United States,Consumer Services,Real Estate
5653,RAIL,FreightCar America Inc. Common Stock,United States,Capital Goods,Railroads
5654,RAMP,LiveRamp Holdings Inc. Common Stock,United States,Technology,EDP Services
5655,RAND,Rand Capital Corporation Common Stock,United States,Finance,Finance: Consumer Services
5656,RAPT,RAPT Therapeutics Inc. Common Stock,United States,Health Care,Major Pharmaceuticals
5657,RARE,Ultragenyx Pharmaceutical Inc. Common Stock,United States,Health Care,Major Pharmaceuticals
5658,RAVE,Rave Restaurant Group Inc. Common Stock,United States,Consumer Non-Durables,Food Distributors
5659,RAVN,Raven Industries Inc. Common Stock,United States,Capital Goods,Specialty Chemicals
5660,RBA,Ritchie Bros. Auctioneers Incorporated Common Stock,Canada,Miscellaneous,Business Services
5661,RBAC,RedBall Acquisition Corp. Class A Ordinary Shares,United States,Finance,Business Services
5662,RBB,RBB Bancorp Common Stock,United States,Finance,Major Banks
5663,RBBN,Ribbon Communications Inc. Common Stock,United States,Technology,EDP Services
5664,RBC,Regal Beloit Corporation Common Stock,United States,Consumer Durables,Metal Fabrications
5665,RBCAA,Republic Bancorp Inc. Class A Common Stock,United States,Finance,Major Banks
5666,RBCN,Rubicon Technology Inc. Common Stock,United States,Technology,Semiconductors
5667,RBKB,Rhinebeck Bancorp Inc. Common Stock,United States,Finance,Banks
5668,RBLX,Roblox Corporation Class A Common Stock,,Technology,Computer Software: Prepackaged Software
5669,RBNC,Reliant Bancorp Inc. Common Stock,United States,Finance,Major Banks
5670,RC,Ready Capital Corproation Common Stock,United States,Consumer Services,Real Estate Investment Trusts
5671,RC^B,Ready Capital Corporation 8.625% Series B Cumulative Preferred Stock,United States,,
5672,RC^C,Ready Capital Corporation 6.25% Series C Cumulative Convertible Preferred Stock,United States,,
5673,RC^D,Ready Capital Corporation 7.625% Series D Cumulative Redeemable Preferred Stock,United States,,
5674,RCA,Ready Capital Corporation 7.00% Convertible Senior Notes due 2023,United States,Consumer Services,Real Estate Investment Trusts
5675,RCB,Ready Capital Corporation 6.20% Senior Notes due 2026,United States,Consumer Services,Real Estate Investment Trusts
5676,RCC,Ready Capital Corporation 5.75% Senior Notes due 2026,United States,Consumer Services,Real Estate Investment Trusts
5677,RCEL,Avita Therapeutics Inc. Common Stock,Australia,Health Care,Medical/Dental Instruments
5678,RCG,RENN Fund Inc Common Stock,United States,,
5679,RCHG,Recharge Acquisition Corp. Class A Common Stock,United States,Finance,Business Services
5680,RCHGW,Recharge Acquisition Corp. Warrant,United States,Finance,Business Services
5681,RCI,Rogers Communication Inc. Common Stock,Canada,Consumer Services,Television Services
5682,RCII,Rent-A-Center Inc. Common Stock,United States,Technology,Diversified Commercial Services
5683,RCKT,Rocket Pharmaceuticals Inc. Common Stock,United States,Health Care,Major Pharmaceuticals
5684,RCKY,Rocky Brands Inc. Common Stock,United States,Consumer Non-Durables,Shoe Manufacturing
5685,RCL,D/B/A Royal Caribbean Cruises Ltd. Common Stock,United States,Consumer Services,Marine Transportation
5686,RCLF,Rosecliff Acquisition Corp I Class A Common Stock,United States,Finance,Business Services
5687,RCLFU,Rosecliff Acquisition Corp I Unit,United States,Finance,Business Services
5688,RCLFW,Rosecliff Acquisition Corp I Warrants,United States,Finance,Business Services
5689,RCM,R1 RCM Inc. Common Stock,United States,Consumer Services,Other Consumer Services
5690,RCMT,RCM Technologies Inc. Common Stock,United States,Technology,Professional Services
5691,RCON,Recon Technology Ltd. Ordinary Shares,China,Energy,Oilfield Services/Equipment
5692,RCS,PIMCO Strategic Income Fund Inc.,United States,,
5693,RCUS,Arcus Biosciences Inc. Common Stock,,Health Care,Major Pharmaceuticals
5694,RDCM,Radcom Ltd. Ordinary Shares,Israel,Technology,Computer peripheral equipment
5695,RDFI,Rareview Dynamic Fixed Income ETF,,,
5696,RDFN,Redfin Corporation Common Stock,United States,Finance,Real Estate
5697,RDHL,Redhill Biopharma Ltd. American Depositary Shares,Israel,Health Care,Major Pharmaceuticals
5698,RDI,Reading International Inc Class A Common Stock,United States,Consumer Services,Movies/Entertainment
5699,RDIB,Reading International Inc Class B Common Stock,United States,Consumer Services,Movies/Entertainment
5700,RDN,Radian Group Inc. Common Stock,United States,Finance,Property-Casualty Insurers
5701,RDNT,RadNet Inc. Common Stock,United States,Health Care,Medical Specialities
5702,RDS/B,Royal Dutch Shell PLC,Netherlands,,
5703,RDUS,Radius Health Inc. Common Stock,United States,Health Care,Major Pharmaceuticals
5704,RDVT,Red Violet Inc. Common Stock ,United States,Technology,Computer Software: Prepackaged Software
5705,RDWR,Radware Ltd. Ordinary Shares,Israel,Miscellaneous,Business Services
5706,RDY,Dr. Reddy's Laboratories Ltd Common Stock,India,Health Care,Major Pharmaceuticals
5707,RE,Everest Re Group Ltd. Common Stock,Bermuda,Finance,Property-Casualty Insurers
5708,REAL,The RealReal Inc. Common Stock,United States,Consumer Services,Other Specialty Stores
5709,REC,Emles Real Estate Credit ETF,,,
5710,REDU,RISE Education Cayman Ltd American Depositary Shares,China,Consumer Services,Other Consumer Services
5711,REED,Reeds Inc. Common Stock,United States,Consumer Non-Durables,Beverages (Production/Distribution)
5712,REFR,Research Frontiers Incorporated Common Stock,United States,Miscellaneous,Multi-Sector Companies
5713,REG,Regency Centers Corporation Common Stock,United States,Consumer Services,Real Estate Investment Trusts
5714,REGI,Renewable Energy Group Inc. Common Stock,United States,Basic Industries,Major Chemicals
5715,REGN,Regeneron Pharmaceuticals Inc. Common Stock,United States,Health Care,Major Pharmaceuticals
5716,REI,Ring Energy Inc. Common Stock,United States,Energy,Oil & Gas Production
5717,REKR,Rekor Systems Inc. Common Stock,United States,Capital Goods,Telecommunications Equipment
5718,RELI,Reliance Global Group Inc. Common Stock,United States,Finance,Specialty Insurers
5719,RELIW,Reliance Global Group Inc. Series A Warrants,United States,Finance,Specialty Insurers
5720,RELL,Richardson Electronics Ltd. Common Stock,United States,Technology,Electronic Components
5721,RELX,RELX PLC PLC American Depositary Shares (Each representing One Ordinary Share),United Kingdom,Miscellaneous,Business Services
5722,RENN,Renren Inc. American Depositary Shares each representing fifteen Class A ordinary shares,China,Consumer Durables,Automotive Aftermarket
5723,REPH,Recro Pharma Inc. Common Stock,United States,Health Care,Major Pharmaceuticals
5724,REPL,Replimune Group Inc. Common Stock,United States,Health Care,Biotechnology: Biological Products (No Diagnostic Substances)
5725,REPX,Riley Exploration Permian Inc. Common Stock,United States,Energy,Oil & Gas Production
5726,RES,RPC Inc. Common Stock,United States,Energy,Oilfield Services/Equipment
5727,RESN,Resonant Inc. Common Stock,United States,Technology,Semiconductors
5728,RETA,Reata Pharmaceuticals Inc. Class A Common Stock,United States,Health Care,Major Pharmaceuticals
5729,RETO,ReTo Eco-Solutions Inc. Common Shares,China,Capital Goods,Industrial Machinery/Components
5730,REV,Revlon Inc. New Common Stock,United States,Consumer Non-Durables,Package Goods/Cosmetics
5731,REVG,REV Group Inc. Common Stock,United States,Capital Goods,Auto Manufacturing
5732,REVHU,Revolution Healthcare Acquisition Corp. SAIL Units,United States,Finance,Business Services
5733,REX,REX American Resources Corporation,United States,Basic Industries,Major Chemicals
5734,REXR,Rexford Industrial Realty Inc. Common Stock,United States,Consumer Services,Real Estate Investment Trusts
5735,REXR^A,Rexford Industrial Realty Inc. 5.875% Series A Cumulative Redeemable Preferred Stock,United States,,
5736,REXR^B,Rexford Industrial Realty Inc. 5.875% Series B Cumulative Redeemable Preferred Stock,United States,,
5737,REXR^C,Rexford Industrial Realty Inc. 5.625% Series C Cumulative Redeemable Preferred Stock par value $0.01 per share,United States,,
5738,REYN,Reynolds Consumer Products Inc. Common Stock,United States,Consumer Durables,Containers/Packaging
5739,REZI,Resideo Technologies Inc. Common Stock ,,Capital Goods,Wholesale Distributors
5740,RF,Regions Financial Corporation Common Stock,United States,Finance,Major Banks
5741,RF^A,Regions Financial Corporation Depositary Shares Representing 1/40th Perpetual Preferred Series A,United States,,
5742,RF^B,Regions Financial Corporation Depositary Shares Representing 1/40th Perpetual Preferred Series B,United States,,
5743,RF^C,Regions Financial Corporation Depositary Shares each Representing a 1/40th Interest in a  Share of 5.700% Fixed-to-Floating Rate Non-Cumulative  Perpetual Preferred Stock Series C,United States,,
5744,RFI,Cohen & Steers Total Return Realty Fund Inc. Common Stock,United States,,
5745,RFIL,RF Industries Ltd. Common Stock,United States,Capital Goods,Electrical Products
5746,RFL,Rafael Holdings Inc. Class B Common Stock,United States,Finance,Real Estate
5747,RFM,RiverNorth Flexible Municipal Income Fund Inc. Common Stock,,,
5748,RFMZ,RiverNorth Flexible Municipal Income Fund II Inc. Common Stock,,,
5749,RFP,Resolute Forest Products Inc. Common Stock,Canada,Basic Industries,Paper
5750,RGA,Reinsurance Group of America Incorporated Common Stock,United States,Finance,Life Insurance
5751,RGCO,RGC Resources Inc. Common Stock,United States,Public Utilities,Oil & Gas Production
5752,RGEN,Repligen Corporation Common Stock,United States,Health Care,Biotechnology: Biological Products (No Diagnostic Substances)
5753,RGLD,Royal Gold Inc. Common Stock,United States,Basic Industries,Precious Metals
5754,RGLS,Regulus Therapeutics Inc. Common Stock,United States,Health Care,Major Pharmaceuticals
5755,RGNX,REGENXBIO Inc. Common Stock,United States,Health Care,Biotechnology: Biological Products (No Diagnostic Substances)
5756,RGP,Resources Connection Inc. Common Stock,United States,Miscellaneous,Business Services
5757,RGR,Sturm Ruger & Company Inc. Common Stock,United States,Capital Goods,Ordnance And Accessories
5758,RGS,Regis Corporation Common Stock,United States,Consumer Services,Other Consumer Services
5759,RGT,Royce Global Value Trust Inc. Common Stock,,,
5760,RH,RH Common Stock,United States,Consumer Services,Other Specialty Stores
5761,RHE,Regional Health Properties Inc. Common Stock,,Consumer Services,Real Estate
5762,RHE^A,Regional Health Properties Inc. 10.875% Series A Cumulative Redeemable Preferred Stock,,,
5763,RHI,Robert Half International Inc. Common Stock,United States,Technology,Professional Services
5764,RHP,Ryman Hospitality Properties Inc. (REIT),United States,Consumer Services,Real Estate Investment Trusts
5765,RIBT,RiceBran Technologies Common Stock,United States,Consumer Non-Durables,Packaged Foods
5766,RICE,Rice Acquisition Corp. Class A Common Stock,United States,Finance,Business Services
5767,RICK,RCI Hospitality Holdings Inc. Common Stock,United States,Consumer Services,Restaurants
5768,RIDE,Lordstown Motors Corp. Class A Common Stock,United States,Capital Goods,Auto Manufacturing
5769,RIG,Transocean Ltd (Switzerland) Common Stock,Switzerland,Energy,Oil & Gas Production
5770,RIGL,Rigel Pharmaceuticals Inc. Common Stock,United States,Health Care,Major Pharmaceuticals
5771,RILY,B. Riley Financial Inc. Common Stock,United States,Miscellaneous,Business Services
5772,RILYG,B. Riley Financial Inc. 7.25% Senior Notes due 2027,United States,Miscellaneous,Business Services
5773,RILYH,B. Riley Financial Inc. 7.375% Senior Notes due 2023,United States,Miscellaneous,Business Services
5774,RILYI,B. Riley Financial Inc. 6.875% Senior Notes due 2023,United States,Miscellaneous,Business Services
