,Symbol,Name,Country,Sector,Industry
0,A,Agilent Technologies Inc. Common Stock,United States,Capital Goods,Biotechnology: Laboratory Analytical Instruments
1,AA,Alcoa Corporation Common Stock ,,Basic Industries,Aluminum
2,AAC,Ares Acquisition Corporation Class A Ordinary Shares,,Finance,Business Services
3,AACG,ATA Creativity Global American Depositary Shares,China,Consumer Services,Other Consumer Services
4,AACQ,Artius Acquisition Inc. Class A Common Stock,United States,Basic Industries,Major Chemicals
5,AACQU,Artius Acquisition Inc. Unit ,United States,Basic Industries,Major Chemicals
6,AACQW,Artius Acquisition Inc Warrant,United States,Basic Industries,Major Chemicals
7,AAIC,Arlington Asset Investment Corp Class A (new),United States,Consumer Services,Real Estate Investment Trusts
8,AAIC^B,Arlington Asset Investment Corp 7.00% ,United States,,
9,AAIC^C,Arlington Asset Investment Corp 8.250% Seies C Fixed-to-Floating Rate Cumulative Redeemable Preferred Stock   ,United States,,
10,AAL,American Airlines Group Inc. Common Stock,United States,Transportation,Air Freight/Delivery Services
11,AAMC,Altisource Asset Management Corp Com,United States,Finance,Real Estate
12,AAME,Atlantic American Corporation Common Stock,United States,Finance,Life Insurance
13,AAN,Aarons Holdings Company Inc. Common Stock ,United States,Technology,Diversified Commercial Services
14,AAOI,Applied Optoelectronics Inc. Common Stock,United States,Technology,Semiconductors
15,AAON,AAON Inc. Common Stock,United States,Capital Goods,Industrial Machinery/Components
16,AAP,Advance Auto Parts Inc Advance Auto Parts Inc W/I,United States,Consumer Services,Other Specialty Stores
17,AAPL,Apple Inc. Common Stock,United States,Technology,Computer Manufacturing
18,AAT,American Assets Trust Inc. Common Stock,United States,Consumer Services,Real Estate Investment Trusts
19,AAU,Almaden Minerals Ltd. Common Shares,Canada,Basic Industries,Precious Metals
20,AAWW,Atlas Air Worldwide Holdings NEW Common Stock,United States,Transportation,Transportation Services
21,AB,AllianceBernstein Holding L.P.  Units,United States,Finance,Investment Managers
22,ABB,ABB Ltd Common Stock,Switzerland,Consumer Durables,Electrical Products
23,ABBV,AbbVie Inc. Common Stock,United States,Health Care,Major Pharmaceuticals
24,ABC,AmerisourceBergen Corporation Common Stock,United States,Health Care,Other Pharmaceuticals
25,ABCB,Ameris Bancorp Common Stock,United States,Finance,Major Banks
26,ABCL,AbCellera Biologics Inc. Common Shares,Canada,Health Care,Major Pharmaceuticals
27,ABCM,Abcam plc American Depositary Shares,United Kingdom,Health Care,Biotechnology: Biological Products (No Diagnostic Substances)
28,ABEO,Abeona Therapeutics Inc. Common Stock,United States,Health Care,Major Pharmaceuticals
29,ABEV,Ambev S.A. American Depositary Shares (Each representing 1 Common Share),,Consumer Non-Durables,Beverages (Production/Distribution)
30,ABG,Asbury Automotive Group Inc Common Stock,United States,Consumer Durables,Automotive Aftermarket
31,ABGI,ABG Acquisition Corp. I Class A Ordinary Shares,United States,Finance,Business Services
32,ABIO,ARCA biopharma Inc. Common Stock,United States,Health Care,Biotechnology: In Vitro & In Vivo Diagnostic Substances
33,ABM,ABM Industries Incorporated Common Stock,United States,Finance,Diversified Commercial Services
34,ABMD,ABIOMED Inc. Common Stock,United States,Health Care,Medical/Dental Instruments
35,ABNB,Airbnb Inc. Class A Common Stock,United States,Finance,Diversified Commercial Services
36,ABR,Arbor Realty Trust Common Stock,United States,Consumer Services,Real Estate Investment Trusts
37,ABR^A,Arbor Realty Trust Preferred Series A,United States,,
38,ABR^B,Arbor Realty Trust Cumulative Redeemable Preferred Series B,United States,,
39,ABR^C,Arbor Realty Trust Cumulative Redeemable Preferred Series C,United States,,
40,ABST,Absolute Software Corporation Common Stock,Canada,Technology,Computer Software: Prepackaged Software
41,ABT,Abbott Laboratories Common Stock,United States,Health Care,Major Pharmaceuticals
42,ABTX,Allegiance Bancshares Inc. Common Stock,United States,Finance,Major Banks
43,ABUS,Arbutus Biopharma Corporation Common Stock,Canada,Health Care,Major Pharmaceuticals
44,AC,Associated Capital Group Inc. Common Stock,United States,Finance,Investment Bankers/Brokers/Service
45,ACA,Arcosa Inc. Common Stock ,,Capital Goods,Metal Fabrications
46,ACAC,Acies Acquisition Corp. Class A Ordinary Share,United States,Technology,Computer Software: Prepackaged Software
47,ACACU,Acies Acquisition Corp. Unit,United States,Technology,Computer Software: Prepackaged Software
48,ACACW,Acies Acquisition Corp. Warrant,United States,Technology,Computer Software: Prepackaged Software
49,ACAD,ACADIA Pharmaceuticals Inc. Common Stock,United States,Health Care,Major Pharmaceuticals
50,ACAHU,Atlantic Coastal Acquisition Corp. Unit,United States,Finance,Business Services
51,ACB,Aurora Cannabis Inc. Common Shares,,Consumer Durables,Specialty Chemicals
52,ACBAU,Ace Global Business Acquisition Limited Unit,Hong Kong,Finance,Business Services
53,ACBI,Atlantic Capital Bancshares Inc. Common Stock,United States,Finance,Major Banks
54,ACC,American Campus Communities Inc Common Stock,United States,Consumer Services,Real Estate Investment Trusts
55,ACCD,Accolade Inc. Common Stock,United States,,
56,ACCO,Acco Brands Corporation Common Stock,United States,Consumer Durables,Publishing
57,ACEL,Accel Entertainment Inc. ,United States,Consumer Services,Services-Misc. Amusement & Recreation
58,ACER,Acer Therapeutics Inc. Common Stock (DE),United States,Health Care,Major Pharmaceuticals
59,ACET,Adicet Bio Inc. Common Stock ,United States,Health Care,Major Pharmaceuticals
60,ACEV,ACE Convergence Acquisition Corp. Class A Ordinary Shares,United States,Technology,Semiconductors
61,ACEVU,ACE Convergence Acquisition Corp. Unit,United States,Technology,Semiconductors
62,ACEVW,ACE Convergence Acquisition Corp. Warrant,United States,Technology,Semiconductors
63,ACGL,Arch Capital Group Ltd. Common Stock,Bermuda,Finance,Property-Casualty Insurers
64,ACGLO,Arch Capital Group Ltd. Depositary Shares Each Representing 1/1000th Interest in a Share of 5.45% Non-Cumulative Preferred Shares Series F,Bermuda,Finance,Property-Casualty Insurers
65,ACGLP,Arch Capital Group Ltd. Depositary Shares Representing Interest in 5.25% Non-Cumulative Preferred Series E Shrs,Bermuda,Finance,Property-Casualty Insurers
66,ACH,Aluminum Corporation of China Limited American Depositary Shares,China,Basic Industries,Aluminum
67,ACHC,Acadia Healthcare Company Inc. Common Stock,United States,Health Care,Medical Specialities
68,ACHL,Achilles Therapeutics plc American Depositary Shares,United Kingdom,Health Care,Biotechnology: Biological Products (No Diagnostic Substances)
69,ACHV,Achieve Life Sciences Inc. Common Shares,United States,Health Care,Biotechnology: In Vitro & In Vivo Diagnostic Substances
70,ACI,Albertsons Companies Inc. Class A Common Stock,United States,Consumer Services,Food Chains
71,ACIC,Atlas Crest Investment Corp. Class A Common Stock,United States,Capital Goods,Aerospace
72,ACII,Atlas Crest Investment Corp. II Class A Common Stock,,Finance,Business Services
73,ACIU,AC Immune SA Common Stock,Switzerland,Health Care,Major Pharmaceuticals
74,ACIW,ACI Worldwide Inc. Common Stock,United States,Technology,Computer Software: Prepackaged Software
75,ACKIT,Ackrell SPAC Partners I Co. Subunits,United States,Finance,Business Services
76,ACKIU,Ackrell SPAC Partners I Co. Units,United States,Finance,Business Services
77,ACKIW,Ackrell SPAC Partners I Co. Warrants,United States,Finance,Business Services
78,ACLS,Axcelis Technologies Inc. Common Stock,United States,Technology,Industrial Machinery/Components
79,ACM,AECOM Common Stock,United States,Consumer Services,Military/Government/Technical
80,ACMR,ACM Research Inc. Class A Common Stock,United States,Technology,Industrial Machinery/Components
81,ACN,Accenture plc Class A Ordinary Shares (Ireland),Ireland,Miscellaneous,Business Services
82,ACNB,ACNB Corporation Common Stock,United States,Finance,Major Banks
83,ACND,Ascendant Digital Acquisition Corp. Class A Ordinary Shares,United States,Technology,Computer Software: Prepackaged Software
84,ACOR,Acorda Therapeutics Inc. Common Stock,United States,Health Care,Biotechnology: Biological Products (No Diagnostic Substances)
85,ACP,Aberdeen Income Credit Strategies Fund Common Shares,United States,,
86,ACQRU,Independence Holdings Corp. Units,United States,Finance,Business Services
87,ACR,ACRES Commercial Realty Corp. Common Stock,United States,Consumer Services,Real Estate Investment Trusts
88,ACR^C,ACRES Commercial Realty Corp. 8.625% Fixed-to-Floating Series C Cumulative Redeemable Preferred Stock ,United States,,
89,ACRE,Ares Commercial Real Estate Corporation Common Stock,United States,Consumer Services,Real Estate Investment Trusts
90,ACRS,Aclaris Therapeutics Inc. Common Stock,United States,Health Care,Major Pharmaceuticals
91,ACRX,AcelRx Pharmaceuticals Inc. Common Stock,United States,Health Care,Major Pharmaceuticals
92,ACST,Acasti Pharma Inc. Class A Common Stock,Canada,Health Care,Major Pharmaceuticals
93,ACTC,ArcLight Clean Transition Corp. Class A Ordinary Shares,United States,Capital Goods,Auto Manufacturing
94,ACTCU,ArcLight Clean Transition Corp. Unit,United States,Capital Goods,Auto Manufacturing
95,ACTCW,ArcLight Clean Transition Corp. Warrant,United States,Capital Goods,Auto Manufacturing
96,ACTDU,ArcLight Clean Transition Corp. II Unit,United States,Finance,Business Services
97,ACTG,Acacia Research Corporation (Acacia Tech) Common Stock,United States,Miscellaneous,Multi-Sector Companies
98,ACU,Acme United Corporation. Common Stock,United States,Capital Goods,Industrial Machinery/Components
99,ACV,Virtus AllianzGI Diversified Income & Convertible Fund Common Shares of Beneficial Interest,United States,,
100,ACVA,ACV Auctions Inc. Class A Common Stock,United States,Miscellaneous,Business Services
101,ACY,AeroCentury Corp. Common Stock,United States,Technology,Diversified Commercial Services
102,ADAG,Adagene Inc. American Depositary Shares,China,Health Care,Major Pharmaceuticals
103,ADAP,Adaptimmune Therapeutics plc American Depositary Shares,United Kingdom,Health Care,Biotechnology: Biological Products (No Diagnostic Substances)
104,ADBE,Adobe Inc. Common Stock,United States,Technology,Computer Software: Prepackaged Software
105,ADC,Agree Realty Corporation Common Stock,United States,Consumer Services,Real Estate Investment Trusts
106,ADCT,ADC Therapeutics SA Common Shares,,Health Care,Major Pharmaceuticals
107,ADER,26 Capital Acquisition Corp. Class A Common Stock,United States,Finance,Business Services
108,ADERU,26 Capital Acquisition Corp. Unit,United States,Finance,Business Services
109,ADERW,26 Capital Acquisition Corp. Warrant,United States,Finance,Business Services
110,ADES,Advanced Emissions Solutions Inc. Common Stock,United States,Basic Industries,Major Chemicals
111,ADEX,Adit EdTech Acquisition Corp. Common Stock,,Finance,Business Services
112,ADFI,Anfield Dynamic Fixed Income ETF,,,
113,ADI,Analog Devices Inc. Common Stock,United States,Technology,Semiconductors
114,ADIL,Adial Pharmaceuticals Inc Common Stock,United States,Health Care,Major Pharmaceuticals
115,ADILW,Adial Pharmaceuticals Inc Warrant,United States,Health Care,Major Pharmaceuticals
116,ADM,Archer-Daniels-Midland Company Common Stock,United States,Consumer Non-Durables,Packaged Foods
117,ADMA,ADMA Biologics Inc Common Stock,United States,Health Care,Biotechnology: Biological Products (No Diagnostic Substances)
118,ADME,Aptus Drawdown Managed Equity ETF,United States,,
119,ADMP,Adamis Pharmaceuticals Corporation Common Stock,United States,Health Care,Major Pharmaceuticals
120,ADMS,Adamas Pharmaceuticals Inc. Common Stock,United States,Health Care,Major Pharmaceuticals
121,ADN,Advent Technologies Holdings Inc. Class A Common Stock,United States,Miscellaneous,Industrial Machinery/Components
122,ADNT,Adient plc Ordinary Shares ,,Capital Goods,Auto Parts:O.E.M.
123,ADNWW,Advent Technologies Holdings Inc. Warrant,United States,Miscellaneous,Industrial Machinery/Components
124,ADOC,Edoc Acquisition Corp. Class A Ordinary Share,United States,Finance,Business Services
125,ADOCR,Edoc Acquisition Corp. Right,United States,Finance,Business Services
126,ADOCW,Edoc Acquisition Corp. Warrant,United States,Finance,Business Services
127,ADP,Automatic Data Processing Inc. Common Stock,United States,Technology,EDP Services
128,ADPT,Adaptive Biotechnologies Corporation Common Stock,United States,Health Care,Biotechnology: Biological Products (No Diagnostic Substances)
129,ADRA,Adara Acquisition Corp. Class A Common Stock,United States,Finance,Business Services
130,ADS,Alliance Data Systems Corporation Common Stock,United States,Miscellaneous,Business Services
131,ADSK,Autodesk Inc. Common Stock,United States,Technology,Computer Software: Prepackaged Software
132,ADT,ADT Inc. Common Stock,United States,Consumer Services,Diversified Commercial Services
133,ADTN,ADTRAN Inc. Common Stock,United States,Public Utilities,Telecommunications Equipment
134,ADTX,ADiTx Therapeutics Inc. Common Stock,United States,Health Care,Major Pharmaceuticals
135,ADUS,Addus HomeCare Corporation Common Stock,United States,Health Care,Medical/Nursing Services
136,ADV,Advantage Solutions Inc. Class A Common Stock,United States,Miscellaneous,Business Services
137,ADVM,Adverum Biotechnologies Inc. Common Stock,United States,Health Care,Biotechnology: Biological Products (No Diagnostic Substances)
138,ADVWW,Advantage Solutions Inc. Warrant,United States,Miscellaneous,Business Services
139,ADX,Adams Diversified Equity Fund Inc.,United States,,
140,ADXN,Addex Therapeutics Ltd American Depositary Shares,Switzerland,Health Care,Major Pharmaceuticals
141,ADXS,Advaxis Inc. Common Stock,United States,Health Care,Major Pharmaceuticals
142,AE,Adams Resources & Energy Inc. Common Stock,United States,Energy,Oil Refining/Marketing
143,AEAC,Authentic Equity Acquisition Corp. Class A ordinary share,United States,Finance,Business Services
144,AEACU,Authentic Equity Acquisition Corp. Unit,United States,Finance,Business Services
145,AEACW,Authentic Equity Acquisition Corp. Warrant,United States,Finance,Business Services
146,AEB,AEGON N.V. Perp. Cap. Secs. Floating Rate (Netherlands),Netherlands,Finance,Life Insurance
147,AEE,Ameren Corporation Common Stock,United States,Public Utilities,Power Generation
148,AEF,Aberdeen Emerging Markets Equity Income Fund Inc. Common Stock,United States,,
149,AEFC,Aegon Funding Company LLC 5.10% Subordinated Notes due 2049,,Finance,Life Insurance
150,AEG,AEGON N.V. Common Stock,Netherlands,Finance,Life Insurance
151,AEGN,Aegion Corp Common Stock,United States,Basic Industries,Water Supply
152,AEHL,Antelope Enterprise Holdings Limited Common Stock (0.024 par),China,Capital Goods,Building Materials
153,AEHR,Aehr Test Systems Common Stock,United States,Capital Goods,Electrical Products
154,AEI,Alset EHome International Inc. Common Stock,United States,Finance,Real Estate
155,AEIS,Advanced Energy Industries Inc. Common Stock,United States,Capital Goods,Industrial Machinery/Components
156,AEL,American Equity Investment Life Holding Company Common Stock,United States,Finance,Life Insurance
157,AEL^A,American Equity Investment Life Holding Company Depositary Shares each representing a 1/1000th interest in a share of 5.95% Fixed-Rate Reset Non-Cumulative Preferred Stock Series A,United States,,
158,AEL^B,American Equity Investment Life Holding Company Depositary Shares each representing a 1/1000th interest in a share of 6.625% Fixed-Rate Reset Non-Cumulative Preferred Stock Series B,United States,,
159,AEM,Agnico Eagle Mines Limited Common Stock,Canada,Basic Industries,Precious Metals
160,AEMD,Aethlon Medical Inc. Common Stock,United States,Health Care,Medical/Dental Instruments
161,AENZ,Aenza S.A.A. American Depositary Shares,,Basic Industries,Military/Government/Technical
162,AEO,American Eagle Outfitters Inc. Common Stock,United States,Consumer Services,Clothing/Shoe/Accessory Stores
163,AEP,American Electric Power Company Inc. Common Stock,United States,Public Utilities,Electric Utilities: Central
164,AEPPL,American Electric Power Company Inc. Corporate Unit,United States,Public Utilities,Electric Utilities: Central
165,AEPPZ,American Electric Power Company Inc. Corporate Units,United States,Public Utilities,Electric Utilities: Central
166,AER,AerCap Holdings N.V. Ordinary Shares,Netherlands,Technology,Diversified Commercial Services
167,AERI,Aerie Pharmaceuticals Inc. Common Stock,United States,Health Care,Biotechnology: Biological Products (No Diagnostic Substances)
168,AES,The AES Corporation Common Stock,United States,Basic Industries,Electric Utilities: Central
169,AESC,The AES Corporation Corporate Units,United States,Basic Industries,Electric Utilities: Central
170,AESE,Allied Esports Entertainment Inc. Common Stock,United States,Consumer Services,Services-Misc. Amusement & Recreation
171,AESR,Anfield U.S. Equity Sector Rotation ETF,,,
172,AEVA,Aeva Technologies Inc. Common Stock,,Capital Goods,Auto Parts:O.E.M.
173,AEY,ADDvantage Technologies Group Inc. Common Stock,United States,Consumer Services,Office Equipment/Supplies/Services
174,AEYE,AudioEye Inc. Common Stock,United States,Technology,Computer Software: Prepackaged Software
175,AEZS,Aeterna Zentaris Inc. Common Stock,Canada,Health Care,Major Pharmaceuticals
176,AFAQU,AF Acquisition Corp. Units,United States,Finance,Business Services
177,AFB,AllianceBernstein National Municipal Income Fund Inc,United States,,
178,AFBI,Affinity Bancshares Inc. Common Stock (MD),United States,Finance,Savings Institutions
179,AFCG,AFC Gamma Inc. Common Stock,United States,Finance,Real Estate
180,AFG,American Financial Group Inc. Common Stock,United States,Finance,Property-Casualty Insurers
181,AFGB,American Financial Group Inc. 5.875% Subordinated Debentures due 2059,United States,Finance,Property-Casualty Insurers
182,AFGC,American Financial Group Inc. 5.125% Subordinated Debentures due 2059,United States,Finance,Property-Casualty Insurers
183,AFGD,American Financial Group Inc. 5.625% Subordinated Debentures due 2060,United States,Finance,Property-Casualty Insurers
184,AFGE,American Financial Group Inc. 4.500% Subordinated Debentures due 2060,United States,Finance,Property-Casualty Insurers
185,AFI,Armstrong Flooring Inc. Common Stock,,Consumer Non-Durables,Plastic Products
186,AFIB,Acutus Medical Inc. Common Stock,United States,Health Care,Medical/Dental Instruments
187,AFIN,American Finance Trust Inc. Class A Common Stock,United States,Consumer Services,Real Estate Investment Trusts
188,AFINO,American Finance Trust Inc. 7.375% Series C Cumulative Redeemable Preferred Stock,United States,Consumer Services,Real Estate Investment Trusts
189,AFINP,American Finance Trust Inc. 7.50% Series A Cumulative Redeemable Perpetual Preferred Stock,United States,Consumer Services,Real Estate Investment Trusts
190,AFL,AFLAC Incorporated Common Stock,United States,Finance,Accident &Health Insurance
191,AFMD,Affimed N.V.,Germany,Health Care,Major Pharmaceuticals
192,AFRM,Affirm Holdings Inc. Class A Common Stock,United States,Miscellaneous,Business Services
193,AFT,Apollo Senior Floating Rate Fund Inc. Common Stock,,,
194,AFYA,Afya Limited Class A Common Shares,Brazil,Consumer Services,Other Consumer Services
195,AG,First Majestic Silver Corp. Ordinary Shares (Canada),Canada,Basic Industries,Precious Metals
196,AGAC,African Gold Acquisition Corporation Class A Ordinary Shares,,Finance,Business Services
197,AGBA,AGBA Acquisition Limited Ordinary Share,Hong Kong,Finance,Business Services
198,AGBAR,AGBA Acquisition Limited Right,Hong Kong,Finance,Business Services
199,AGBAW,AGBA Acquisition Limited Warrant,Hong Kong,Finance,Business Services
200,AGC,Altimeter Growth Corp. Class A Ordinary Shares,United States,Finance,Business Services
201,AGCB,Altimeter Growth Corp. 2 Class A Ordinary Shares,,Finance,Business Services
202,AGCO,AGCO Corporation Common Stock,United States,Capital Goods,Industrial Machinery/Components
203,AGCUU,Altimeter Growth Corp. Unit,United States,Finance,Business Services
204,AGCWW,Altimeter Growth Corp. Warrant,United States,Finance,Business Services
205,AGD,Aberdeen Global Dynamic Dividend Fund,United States,,
206,AGE,AgeX Therapeutics Inc. Common Stock,,Health Care,Major Pharmaceuticals
207,AGEN,Agenus Inc. Common Stock,United States,Health Care,Biotechnology: Biological Products (No Diagnostic Substances)
208,AGFS,AgroFresh Solutions Inc. Common Stock,United States,Basic Industries,Agricultural Chemicals
209,AGFY,Agrify Corporation Common Stock,United States,Consumer Non-Durables,Farming/Seeds/Milling
210,AGGRU,Agile Growth Corp. Units,United States,Finance,Business Services
211,AGI,Alamos Gold Inc. Class A Common Shares,Canada,Basic Industries,Precious Metals
212,AGIO,Agios Pharmaceuticals Inc. Common Stock,United States,Health Care,Major Pharmaceuticals
213,AGLE,Aeglea BioTherapeutics Inc. Common Stock,United States,Health Care,Major Pharmaceuticals
214,AGM,Federal Agricultural Mortgage Corporation Common Stock,United States,Finance,Finance Companies
215,AGM^C,Federal Agricultural Mortgage Corporation Preferred Series C Fixed to Fltg,United States,,
216,AGM^D,Federal Agricultural Mortgage Corporation 5.700% Non-Cumulative Preferred Stock Series D,United States,,
217,AGM^E,Federal Agricultural Mortgage Corporation 5.750% Non-Cumulative Preferred Stock Series E,United States,,
218,AGM^F,Federal Agricultural Mortgage Corporation 5.250% Non-Cumulative Preferred Stock Series F,United States,,
219,AGMH,AGM Group Holdings Inc. Class A Ordinary Shares,Hong Kong,Technology,EDP Services
220,AGNC,AGNC Investment Corp. Common Stock,United States,Consumer Services,Real Estate Investment Trusts
221,AGNCM,AGNC Investment Corp. Depositary Shares rep 6.875% Series D Fixed-to-Floating Cumulative Redeemable Preferred Stock,United States,Consumer Services,Real Estate Investment Trusts
222,AGNCN,AGNC Investment Corp. Depositary Shares Each Representing a 1/1000th Interest in a Share of 7.00% Series C Fixed-To-Floating Rate Cumulative Redeemable Preferred Stock,United States,Consumer Services,Real Estate Investment Trusts
223,AGNCO,AGNC Investment Corp. Depositary Shares each representing a 1/1000th interest in a share of 6.50% Series E Fixed-to-Floating Cumulative Redeemable Preferred Stock,United States,Consumer Services,Real Estate Investment Trusts
224,AGNCP,AGNC Investment Corp. Depositary Shares Each Representing a 1/1000th Interest in a Share of 6.125% Series F Fixed-to-Floating Rate Cumulative Redeemable Preferred Stock,United States,Consumer Services,Real Estate Investment Trusts
225,AGO,Assured Guaranty Ltd. Common Stock,Bermuda,Finance,Property-Casualty Insurers
226,AGO^B,Assured Guaranty Ltd.,Bermuda,,
227,AGO^E,Assured Guaranty Ltd.,Bermuda,,
228,AGO^F,Assured Guaranty Ltd.,Bermuda,,
229,AGR,Avangrid Inc. Common Stock,United States,Public Utilities,Electric Utilities: Central
230,AGRO,Adecoagro S.A. Common Shares,Luxembourg,Consumer Non-Durables,Farming/Seeds/Milling
231,AGRX,Agile Therapeutics Inc. Common Stock,United States,Health Care,Major Pharmaceuticals
232,AGS,PlayAGS Inc. Common Stock,United States,Consumer Durables,Miscellaneous manufacturing industries
233,AGTC,Applied Genetic Technologies Corporation Common Stock,United States,Health Care,Biotechnology: Biological Products (No Diagnostic Substances)
234,AGX,Argan Inc. Common Stock,United States,Basic Industries,Engineering & Construction
235,AGYS,Agilysys Inc. Common Stock,United States,Technology,EDP Services
236,AHAC,Alpha Healthcare Acquisition Corp. Class A Common Stock,United States,Finance,Business Services
237,AHACU,Alpha Healthcare Acquisition Corp. Unit,United States,Finance,Business Services
238,AHACW,Alpha Healthcare Acquisition Corp. Warrant,United States,Finance,Business Services
239,AHC,A.H. Belo Corporation (TX) Common Stock,United States,Consumer Services,Newspapers/Magazines
240,AHCO,AdaptHealth Corp. Class A Common Stock,United States,Health Care,Medical/Nursing Services
241,AHH,Armada Hoffler Properties Inc. Common Stock,United States,Finance,Real Estate
242,AHH^A,Armada Hoffler Properties Inc. 6.75% Series A Cumulative Redeemable Perpetual Preferred Stock,United States,,
243,AHL^C,Aspen Insurance Holdings Limited 5.95% Fixed-to-Floating Rate Perpetual Non-Cumulative Preference Shares,Bermuda,,
244,AHL^D,Aspen Insurance Holdings Limited 5.625% Perpetual Non-Cumulative Preference Shares,Bermuda,,
245,AHL^E,Aspen Insurance Holdings Limited Depositary Shares each representing a 1/1000th interest in a share of 5.625% Perpetual Non-Cumulative Preference Shares,Bermuda,,
246,AHPI,Allied Healthcare Products Inc. Common Stock,United States,Health Care,Industrial Specialties
247,AHT,Ashford Hospitality Trust Inc Common Stock,United States,Consumer Services,Real Estate Investment Trusts
248,AHT^D,Ashford Hospitality Trust Inc 8.45% Series D Cumulative Preferred Stock,United States,,
249,AHT^F,Ashford Hospitality Trust Inc 7.375% Series F Cumulative Preferred Stock,United States,,
250,AHT^G,Ashford Hospitality Trust Inc 7.375% Series G Cumulative Preferred Stock,United States,,
251,AHT^H,Ashford Hospitality Trust Inc 7.50% Series H Cumulative Preferred Stock,United States,,
252,AHT^I,Ashford Hospitality Trust Inc 7.50% Series I Cumulative Preferred Stock,United States,,
253,AI,C3.ai Inc. Class A Common Stock,,Technology,Computer Software: Prepackaged Software
254,AIC,Arlington Asset Investment Corp 6.750% Notes due 2025,United States,Consumer Services,Real Estate Investment Trusts
255,AIF,Apollo Tactical Income Fund Inc. Common Stock,,,
256,AIG,American International Group Inc. New Common Stock,United States,Finance,Property-Casualty Insurers
